Rank,Name,Tagline,Votes,Comments,URL,Website,Topics,Description,Created At
1,Clear for Slack,Clear messages get answered quicker,81,1,https://www.producthunt.com/products/shortr-2?utm_campaign=producthunt-api&utm_medium=api-v2&utm_source=Application%3A+RanBOT+%28ID%3A+231881%29,https://www.producthunt.com/r/O2XX5TBDG3G3TH?utm_campaign=producthunt-api&utm_medium=api-v2&utm_source=Application%3A+RanBOT+%28ID%3A+231881%29,Slack,"Clear is a Slack app that helps you write clearer, more direct workplace messages. Privacy-first, no message storage, with built-in coaching to help you improve over time.",2026-01-02T08:01:00.000Z
2,"AI Studio - Model Photoshoots, No Studio",Create Professional Photoshoots & Visuals Without a Studio,15,3,https://www.producthunt.com/products/ai-studio-model-photoshoots-no-studio?utm_campaign=producthunt-api&utm_medium=api-v2&utm_source=Application%3A+RanBOT+%28ID%3A+231881%29,https://www.producthunt.com/r/6YRD6GZRJYNI47?utm_campaign=producthunt-api&utm_medium=api-v2&utm_source=Application%3A+RanBOT+%28ID%3A+231881%29,"Productivity, Fashion, Photography","Create professional photoshoots and visuals without a studio. AI Studio helps fashion brands generate stunning on-model product images in seconds. From clothing to accessories, create high-quality AI photoshoots that highlight designs, speed up product launches, and keep a consistent brand look — all without expensive studio setups. • Fashion Photography • Accessories Photography • Product Photography • Marketing & Ad Visuals AI Studio is built for modern brands.",2026-01-02T08:01:00.000Z
3,70Lives – Beauty Business App,"Smart pricing, real-time tax clarity & expense tracking",8,3,https://www.producthunt.com/products/70lives-beauty-business-app?utm_campaign=producthunt-api&utm_medium=api-v2&utm_source=Application%3A+RanBOT+%28ID%3A+231881%29,https://www.producthunt.com/r/UWRSTP2LG244O2?utm_campaign=producthunt-api&utm_medium=api-v2&utm_source=Application%3A+RanBOT+%28ID%3A+231881%29,"Web App, Productivity, Artificial Intelligence","70Lives is the all-in-one business app built for self-employed beauty professionals. Track income, expenses and receipts instantly. See real-time tax estimates and price treatments accurately. AI features include OCR receipt scanning and voice-to-text entry to log sales and costs effortlessly. Built by a tax professional for lash techs, nail techs, MUAs, PMU artists and salons - not a generic bookkeeping software!",2026-01-02T08:01:00.000Z
4,Community Figma MCP server,Allow AI Agents to help you with Figma designs!,3,1,https://www.producthunt.com/products/community-figma-mcp-server?utm_campaign=producthunt-api&utm_medium=api-v2&utm_source=Application%3A+RanBOT+%28ID%3A+231881%29,https://www.producthunt.com/r/DXMHWMCOGSVI4E?utm_campaign=producthunt-api&utm_medium=api-v2&utm_source=Application%3A+RanBOT+%28ID%3A+231881%29,"Design Tools, GitHub","The unofficial Figma Model Context Protocol(MCP) server is a missing link between your AI agent and the Figma design document. Now, AI agents can create, edit, and arrange your Figma design. You can use it together with ChatGPT, Claude Desktop, Cursor, or any other client that supports MCP. The project is free and open source. You don't need anything extra. You use Figma together with your LLM.",2026-01-02T08:01:00.000Z
5,World TripPin,Pin your travels. See your world. Share your story.,3,1,https://www.producthunt.com/products/world-trippin?utm_campaign=producthunt-api&utm_medium=api-v2&utm_source=Application%3A+RanBOT+%28ID%3A+231881%29,https://www.producthunt.com/r/IK3VBQT5FQJVWT?utm_campaign=producthunt-api&utm_medium=api-v2&utm_source=Application%3A+RanBOT+%28ID%3A+231881%29,Travel,"Meet WorldTrippin — a simple, beautiful way to visualize your travels on a world map. Add places you’ve visited, highlight entire countries you’ve explored, and share your journey with a unique link. Pin cities, see your travel footprint instantly, no login, no setup — totally free. Turn memories into a world you can proudly share 🌎",2026-01-02T08:01:00.000Z
6,Timelines Time Tracking 4,Track your time to achieve your New Year resolutions.,3,1,https://www.producthunt.com/products/timelines?utm_campaign=producthunt-api&utm_medium=api-v2&utm_source=Application%3A+RanBOT+%28ID%3A+231881%29,https://www.producthunt.com/r/FFU62X63DKZHYD?utm_campaign=producthunt-api&utm_medium=api-v2&utm_source=Application%3A+RanBOT+%28ID%3A+231881%29,Productivity,"Track your time on an interactive timeline, see where it’s going, and find more time for the things you care about. This is great also for reaching your New Year resolutions. Timelines 4 brings easier management and tracking of subcategories, combined goals, improved Live Activity and Shortcuts integration, and more.",2026-01-02T08:01:00.000Z
7,Griply 2026,Achieve your goals with a goal-oriented task manager,2,1,https://www.producthunt.com/products/griply?utm_campaign=producthunt-api&utm_medium=api-v2&utm_source=Application%3A+RanBOT+%28ID%3A+231881%29,https://www.producthunt.com/r/I43FDFKZTCQJES?utm_campaign=producthunt-api&utm_medium=api-v2&utm_source=Application%3A+RanBOT+%28ID%3A+231881%29,"Productivity, Task Management, Calendar","Most goals fail because they never translate into daily action. Griply is a goal-oriented task manager that connects your goals, habits, tasks, and calendar in one easy-to-use system. Plan your goals for 2026, break them down into daily actions, schedule time for what matters, and track measurable progress over time with a planner designed around outcomes, not just tasks.",2026-01-02T08:01:00.000Z
8,ConvoBlog,Transform AI Conversations into Professional Blogs,2,1,https://www.producthunt.com/products/convoblog?utm_campaign=producthunt-api&utm_medium=api-v2&utm_source=Application%3A+RanBOT+%28ID%3A+231881%29,https://www.producthunt.com/r/T5WBVNEB6D7TJJ?utm_campaign=producthunt-api&utm_medium=api-v2&utm_source=Application%3A+RanBOT+%28ID%3A+231881%29,"Writing, Social Media, SEO","Transform your conversations with AI into meaningful blog posts. Convert ChatGPT, Claude, Gemini chats into SEO-optimized content.",2026-01-02T08:01:00.000Z
9,HTML5 Component Library,Reusable HTML components for faster front-end builds.,1,1,https://www.producthunt.com/products/html5-component-library?utm_campaign=producthunt-api&utm_medium=api-v2&utm_source=Application%3A+RanBOT+%28ID%3A+231881%29,https://www.producthunt.com/r/5FF2B2RSQZVBBA?utm_campaign=producthunt-api&utm_medium=api-v2&utm_source=Application%3A+RanBOT+%28ID%3A+231881%29,"Design Tools, Open Source, Developer Tools, GitHub","HTML5 Component Library is a practical, framework-free collection of reusable HTML components you can drop straight into real projects. It’s built for developers, designers, and learners who want clean, readable HTML without heavy frameworks or build steps. Components focus on common UI patterns — things like buttons, layouts, forms, navigation, and everyday interface building blocks — all shown with visual examples and copy-paste friendly code. Free to use and proudly open-source.",2026-01-02T08:01:00.000Z
10,PIXELPEDIA,The 8-bit knowledge base,1,1,https://www.producthunt.com/products/pixelpedia?utm_campaign=producthunt-api&utm_medium=api-v2&utm_source=Application%3A+RanBOT+%28ID%3A+231881%29,https://www.producthunt.com/r/H2TXMC4OQ5L7AL?utm_campaign=producthunt-api&utm_medium=api-v2&utm_source=Application%3A+RanBOT+%28ID%3A+231881%29,"Education, Games, Web3","Pixelpedia is the Encyclopedia and Cultural Hub of the ecosystem. It is the site that provides the ""Who, What, Where, and Why"" for every dot on the map. By centralizing the community's knowledge, it ensures that the ""Pixel Universe"" remains organized, historical, and deeply intellectual. It is the ultimate resource for any user who wants to understand the soul of the ""Hardcore"" world.",2026-01-02T08:01:00.000Z
11,Pixel Chronometer,pixel timecounter,1,1,https://www.producthunt.com/products/pixel-chronometer?utm_campaign=producthunt-api&utm_medium=api-v2&utm_source=Application%3A+RanBOT+%28ID%3A+231881%29,https://www.producthunt.com/r/LGONWXFNECJSO5?utm_campaign=producthunt-api&utm_medium=api-v2&utm_source=Application%3A+RanBOT+%28ID%3A+231881%29,"Time Tracking, Developer Tools, Tech","Pixel Timer Zero is the Atomic Heart and Synchronization Engine of the ecosystem. It is the site that ensures ""Time"" is a reliable, high-precision asset for every user. By providing a ""Universal Pulse,"" it turns individual actions into a collective, historical movement, ensuring that the ""Pixel Universe"" is always in perfect harmony. It is the site that tells you: ""Every millisecond matters.""",2026-01-02T08:01:00.000Z
12,Supaguard ,"Scan, Detect & Protect Your Supabase Data",1,1,https://www.producthunt.com/products/supaguard?utm_campaign=producthunt-api&utm_medium=api-v2&utm_source=Application%3A+RanBOT+%28ID%3A+231881%29,https://www.producthunt.com/r/FLS6I7US3EISG5?utm_campaign=producthunt-api&utm_medium=api-v2&utm_source=Application%3A+RanBOT+%28ID%3A+231881%29,"SaaS, Developer Tools, Security","I’ve seen many Supabase apps accidentally expose PII, PCI, or hardcoded keys. It’s easy to miss and expensive to fix. So I built Supaguard — it scans your app in minutes and shows exactly what’s exposed. • No setup, just connect • Detects PII, PCI & API keys • Instant alerts Launch offer: 2 free scans + 35% New Year discount 👉 supaguard.pro Feedback welcome — built to help devs stay safe without headaches.",2026-01-02T08:01:00.000Z
13,SimplyHeadlines,The 2006 Sensation is Back!,1,1,https://www.producthunt.com/products/simplyheadlines?utm_campaign=producthunt-api&utm_medium=api-v2&utm_source=Application%3A+RanBOT+%28ID%3A+231881%29,https://www.producthunt.com/r/RULIQAFAK2SQNU?utm_campaign=producthunt-api&utm_medium=api-v2&utm_source=Application%3A+RanBOT+%28ID%3A+231881%29,"Email, News, Artificial Intelligence","SimplyHeadlines, the daily email newsletter that TechCrunch called ""Five Years Too Late"" in 2006, is back: the once-a-day email newspaper you control. Pick your RSS feeds, add fun widgets (weather, stocks, joke of the day, Trump-eraseer, etc.), and get a clean “top headlines only” digest—now with a sprinkle of AI for feed discovery and quick summaries. Will everyone want this? Hell no. Might you? Who knows? Is it now 25 years too late? Only you can decide.",2026-01-02T08:01:00.000Z
14,EasyFiles,Privacy-first file tools that work fully in your browser,1,1,https://www.producthunt.com/products/easyfiles?utm_campaign=producthunt-api&utm_medium=api-v2&utm_source=Application%3A+RanBOT+%28ID%3A+231881%29,https://www.producthunt.com/r/PGTLRNPH643QEB?utm_campaign=producthunt-api&utm_medium=api-v2&utm_source=Application%3A+RanBOT+%28ID%3A+231881%29,"Design Tools, Productivity, Developer Tools","EasyFiles is a privacy-first, browser-based file utility platform that lets you edit PDFs, convert files, extract text (OCR), and protect documents — all without uploading your files. Everything runs fully on your device, making it faster and safer than traditional online tools. No ads, no signup, unlimited usage, and works offline.",2026-01-02T08:01:00.000Z
15,WorkoutLogs v2,Lift. Log. Analyze. The distraction-free gym tracker.,1,1,https://www.producthunt.com/products/workout-logs-gym-tracker?utm_campaign=producthunt-api&utm_medium=api-v2&utm_source=Application%3A+RanBOT+%28ID%3A+231881%29,https://www.producthunt.com/r/ZFTOUL3WYQACCC?utm_campaign=producthunt-api&utm_medium=api-v2&utm_source=Application%3A+RanBOT+%28ID%3A+231881%29,"Android, Notes, Fitness, Weightlifting","The no-nonsense workout logger is back and better than ever. ☁️ We added Cloud Sync, so you never lose a rep. 🏋‍♂️ WorkoutLogs removes the friction from training: instantly calculate which plates to load, estimate your 1RM, and track RPE without spreadsheets. 📈 Create custom routines, track body measurements, and analyze your strength progression with our new beautiful dashboard.",2026-01-02T08:01:00.000Z
16,Name of the launch,Turn every link into insights with Plinkly AI,1,1,https://www.producthunt.com/products/plink-ly?utm_campaign=producthunt-api&utm_medium=api-v2&utm_source=Application%3A+RanBOT+%28ID%3A+231881%29,https://www.producthunt.com/r/OMBXJ7NVUZHUS2?utm_campaign=producthunt-api&utm_medium=api-v2&utm_source=Application%3A+RanBOT+%28ID%3A+231881%29,"Analytics, Marketing, SaaS","Plinkly is a smart link shortener and analytics platform that turns every link into measurable performance. Create short links and UTM campaigns, track clicks with detailed breakdowns, and understand results faster with Plinkly AI. The new AI Analytics summarizes what’s working, what changed, and what to optimize next. Plinkly AI Copilot (Beta) answers questions about your data inside the dashboard, helping you make decisions in seconds instead of digging through charts.",2026-01-02T08:01:00.000Z
17,Are You Aligned With AI?,Take a 2 min quiz and see which AI model thinks like you,1,1,https://www.producthunt.com/products/are-you-aligned-with-ai?utm_campaign=producthunt-api&utm_medium=api-v2&utm_source=Application%3A+RanBOT+%28ID%3A+231881%29,https://www.producthunt.com/r/5N5E4RPYJNEIQA?utm_campaign=producthunt-api&utm_medium=api-v2&utm_source=Application%3A+RanBOT+%28ID%3A+231881%29,"Free Games, Artificial Intelligence, Games","Find out which AI model thinks like you. Take the quiz and compare your answers with GPT-5, Claude, Gemini, and more.",2026-01-02T08:01:00.000Z
18,GamerTag Generator,Create gamertags for your games accounts.,1,1,https://www.producthunt.com/products/names-combiner?utm_campaign=producthunt-api&utm_medium=api-v2&utm_source=Application%3A+RanBOT+%28ID%3A+231881%29,https://www.producthunt.com/r/3255FGZCZGGFWI?utm_campaign=producthunt-api&utm_medium=api-v2&utm_source=Application%3A+RanBOT+%28ID%3A+231881%29,Games,Create gamertags for your games accounts.,2026-01-02T08:01:00.000Z
19,Square Face Generator,"Mix parts, randomize, and export a pixel avatar.",1,1,https://www.producthunt.com/products/square-face-generator-2?utm_campaign=producthunt-api&utm_medium=api-v2&utm_source=Application%3A+RanBOT+%28ID%3A+231881%29,https://www.producthunt.com/r/4TGYX277YGCYTS?utm_campaign=producthunt-api&utm_medium=api-v2&utm_source=Application%3A+RanBOT+%28ID%3A+231881%29,"Funny, Design Tools, Art","Square Face Generator is a free, browser-based pixel avatar maker. Mix parts (hair, eyes, mouth), randomize styles, and export your avatar as a transparent PNG — no signup needed. Perfect for profile pics, game characters, and just having fun.",2026-01-02T08:01:00.000Z
20,Groceed,"Completely refreshed interface, more fast and stable",1,0,https://www.producthunt.com/products/groceed?utm_campaign=producthunt-api&utm_medium=api-v2&utm_source=Application%3A+RanBOT+%28ID%3A+231881%29,https://www.producthunt.com/r/GOZ4PB42JXEE3N?utm_campaign=producthunt-api&utm_medium=api-v2&utm_source=Application%3A+RanBOT+%28ID%3A+231881%29,"Android, User Experience, Database","We refreshed the interface following Material Design 3 (Expressive), focusing on better clarity and visual hierarchy. Under the hood, the entire codebase has been refactored to fully embrace SvelteKit and is now running on Cloudflare Workers. We also migrated from MongoDB to Cloudflare D1. The result is a dramatic performance boost—everything feels noticeably faster.",2026-01-02T08:01:00.000Z
