Rank,Name,Tagline,Votes,Comments,URL,Website,Topics,Description,Created At
1,Firma.dev,E-signatures API for your app averaging ~3¢ per envelope,0,1,https://www.producthunt.com/products/firma-dev?utm_campaign=producthunt-api&utm_medium=api-v2&utm_source=Application%3A+RanBOT+%28ID%3A+231881%29,https://www.producthunt.com/r/MJGLBAKR5ANIUY?utm_campaign=producthunt-api&utm_medium=api-v2&utm_source=Application%3A+RanBOT+%28ID%3A+231881%29,"API, Developer Tools","At €0.029 per envelope (about 3¢), Firma.dev runs about 99% cheaper than DocuSign, where one envelope can cost $4-5. Pay-as-you-go, no minimums, no contracts. Built developer-first for startups and SaaS teams who'd rather integrate signing in an afternoon than sit through a sales cycle: clean REST API, embeddable template and signing editors, integration in hours. Test everything free with a sandbox key, real docs and unlimited usage, before you pay a cent. Get an API key and start building.",2026-06-12T07:01:00.000Z
2,Pond,"Fundraising, GTM, and bounties for startups",0,1,https://www.producthunt.com/products/pond-5?utm_campaign=producthunt-api&utm_medium=api-v2&utm_source=Application%3A+RanBOT+%28ID%3A+231881%29,https://www.producthunt.com/r/CTIMFBPUPVXIGE?utm_campaign=producthunt-api&utm_medium=api-v2&utm_source=Application%3A+RanBOT+%28ID%3A+231881%29,"Marketing, Artificial Intelligence, Fundraising","Pond is the market infrastructure for the new startup economy. Verified founders raise capital, acquire customers, and access 20,000+ contributors in one place. · Markets: Stripe-verified metrics + Vault-protected funding. One startup raised $150K in 3 minutes. · Bounties: 10,000+ submissions, $36K+ distributed. Ethereum Foundation, GPTZero, PhotoBase. · AI Growth Agent: CRM, pipeline, and GTM on autopilot. 400+ startups · 154 countries · Archetype & Coinbase Ventures.",2026-06-12T07:01:00.000Z
3,Insta360 Luna Ultra,A gimbal camera that sees with you,0,1,https://www.producthunt.com/products/insta-360?utm_campaign=producthunt-api&utm_medium=api-v2&utm_source=Application%3A+RanBOT+%28ID%3A+231881%29,https://www.producthunt.com/r/DWWY6SSAPT22S2?utm_campaign=producthunt-api&utm_medium=api-v2&utm_source=Application%3A+RanBOT+%28ID%3A+231881%29,"Hardware, Photography, Video cameras","Insta360 Luna Ultra is an 8K gimbal camera with a 1"" Leica Summicron main lens, 1/1.3"" telephoto lens, 3-axis stabilization, detachable 2"" OLED touchscreen, AI tracking, 10-bit I-Log, built-in storage, and POV shooting accessories.",2026-06-12T07:01:00.000Z
4,Qursor,Point at any UI to send exact context to your AI,0,1,https://www.producthunt.com/products/qursor?utm_campaign=producthunt-api&utm_medium=api-v2&utm_source=Application%3A+RanBOT+%28ID%3A+231881%29,https://www.producthunt.com/r/UZAN2BZTEQ2HT3?utm_campaign=producthunt-api&utm_medium=api-v2&utm_source=Application%3A+RanBOT+%28ID%3A+231881%29,"Productivity, Developer Tools, Artificial Intelligence","I kept wasting AI tokens describing UI changes to agents that edited the wrong element. So I built Qursor. Point at any element, copy structured context (selectors, classes, styles, fonts, colors), paste into your AI agent. No vague screenshots. No burned credits. - Inspect fonts, colors, spacing - Copy AI-ready element context - Extract components as HTML/CSS/JSX - Color picker and font detector - Download assets from any page",2026-06-12T07:01:00.000Z
5,HyperSleep,Block social media until you've actually slept,0,4,https://www.producthunt.com/products/hypersleep?utm_campaign=producthunt-api&utm_medium=api-v2&utm_source=Application%3A+RanBOT+%28ID%3A+231881%29,https://www.producthunt.com/r/OUIBT5QXMTJNMM?utm_campaign=producthunt-api&utm_medium=api-v2&utm_source=Application%3A+RanBOT+%28ID%3A+231881%29,"Android, Health & Fitness, Productivity","Every screen-time app fails for the same reason: you have to turn it on and at 1am, you won't. HyperSleep flips it. Your social apps stay locked until multi-sensor detection verifies you actually slept. It auto-starts at bedtime, runs 100% on-device, and turns ""scroll less"" from willpower into an outcome you earn. Android.",2026-06-12T07:01:00.000Z
6,NODUS PH Radar for Product Hunt,Product Hunt analytics beyond the daily leaderboard,0,3,https://www.producthunt.com/products/nodus-ph-radar-for-product-hunt?utm_campaign=producthunt-api&utm_medium=api-v2&utm_source=Application%3A+RanBOT+%28ID%3A+231881%29,https://www.producthunt.com/r/FXQZONNO5ERVJ2?utm_campaign=producthunt-api&utm_medium=api-v2&utm_source=Application%3A+RanBOT+%28ID%3A+231881%29,"Browser Extensions, Chrome Extensions, Productivity, Analytics","NODUS PH Radar helps makers analyze Product Hunt launches beyond the daily rankings. Explore launch velocity, race dynamics, watch rules, community spotlight opportunities, historical patterns, and upcoming scheduled launches. Gain context before launch day and understand what drives visibility and engagement.",2026-06-12T07:01:00.000Z
7,Tide,Layered voice notes that paint themselves,0,1,https://www.producthunt.com/products/tide-beautiful-layered-voice-notes?utm_campaign=producthunt-api&utm_medium=api-v2&utm_source=Application%3A+RanBOT+%28ID%3A+231881%29,https://www.producthunt.com/r/7OOQ3ZWQ3PE3IK?utm_campaign=producthunt-api&utm_medium=api-v2&utm_source=Application%3A+RanBOT+%28ID%3A+231881%29,"Music, User Experience, Audio","Tide turns voice memos into layered sound sketches. Takes stack onto one tape — hum a bassline, beatbox over it, sing the hook. The waveform paints itself as you record. Scrub like vinyl, loop the good part, send it to Choppa or your DAW. No subs, no cloud. Launch month — 50% off until the end of July!",2026-06-12T07:01:00.000Z
8,Bob's CLI,A local-first AI coding CLI that adapts to you,0,1,https://www.producthunt.com/products/bob-s-cli?utm_campaign=producthunt-api&utm_medium=api-v2&utm_source=Application%3A+RanBOT+%28ID%3A+231881%29,https://www.producthunt.com/r/EEQXQXCFJJTAFZ?utm_campaign=producthunt-api&utm_medium=api-v2&utm_source=Application%3A+RanBOT+%28ID%3A+231881%29,"Developer Tools, Artificial Intelligence, GitHub, Vibe coding","Bob's CLI runs on your own hardware with zero API costs, zero data leaving your machine. Bob lives in your terminal, sees your actual files, and writes code only with your explicit approval. What makes it different: auto-detect local AI models, behavioral DNA profiling that adapts to how YOU work, autonomous code review + auto-fix, conversation forking, deep dives, and SovereignLink — remote execution from any device while your code stays home. Free to start. Sovereign by design.",2026-06-12T07:01:00.000Z
9,Meet Warren 3.0,Your voice-supported AI financial planning partner,0,2,https://www.producthunt.com/products/underpay?utm_campaign=producthunt-api&utm_medium=api-v2&utm_source=Application%3A+RanBOT+%28ID%3A+231881%29,https://www.producthunt.com/r/ITHILQTGL6E2JY?utm_campaign=producthunt-api&utm_medium=api-v2&utm_source=Application%3A+RanBOT+%28ID%3A+231881%29,"Fintech, Artificial Intelligence, Personal Finance","One voice conversation. Free financial plan. We built Warren because financial planning was broken for anyone without a six-figure portfolio. IFAs charge £200/hr. Spreadsheets go stale. Generic apps tell you what you already know. Warren shows you two futures: what happens if you do nothing and what changes if you act. Then Warren gives you a set of next steps, tracks your progress, and monitors your plan against economic changes. Join 3K+ Brits already using Warren. 10 mins to start.",2026-06-12T07:01:00.000Z
10,ShellMate,"Manage SSH servers, credentials, and teams in one place",0,1,https://www.producthunt.com/products/shellmate-2?utm_campaign=producthunt-api&utm_medium=api-v2&utm_source=Application%3A+RanBOT+%28ID%3A+231881%29,https://www.producthunt.com/r/U2DUIA53LZKYV3?utm_campaign=producthunt-api&utm_medium=api-v2&utm_source=Application%3A+RanBOT+%28ID%3A+231881%29,"Productivity, Privacy, Developer Tools","ShellMate is a modern, ultra-fast, and secure SSH client featuring a zero-knowledge encrypted vault, cross-device sync, and advanced team workspace collaboration.",2026-06-12T07:01:00.000Z
11,Clutch Alarm,Sleep through the night. Wake up for the goals.,0,1,https://www.producthunt.com/products/clutch-alarm?utm_campaign=producthunt-api&utm_medium=api-v2&utm_source=Application%3A+RanBOT+%28ID%3A+231881%29,https://www.producthunt.com/r/S3T3237WSR3LYF?utm_campaign=producthunt-api&utm_medium=api-v2&utm_source=Application%3A+RanBOT+%28ID%3A+231881%29,"iOS, Football, Soccer","The World Cup is in North America, so for fans in Europe the big matches kick off at 3 AM. Clutch Alarm watches every live match and only wakes you — loud, full-screen, past silent mode — when it's worth it: a goal, a one-goal finish, your team in trouble. Sleep through the 0-0 first halves; wake up for the drama. And even if you're awake, it pings you the second a big moment happens — so you never miss one. Started as an NBA alarm, now covers football too.",2026-06-12T07:01:00.000Z
12,KOSH Money,USD account & credit cards for freelancers & creators,0,3,https://www.producthunt.com/products/kosh-money?utm_campaign=producthunt-api&utm_medium=api-v2&utm_source=Application%3A+RanBOT+%28ID%3A+231881%29,https://www.producthunt.com/r/U4HHKG6LASDTLK?utm_campaign=producthunt-api&utm_medium=api-v2&utm_source=Application%3A+RanBOT+%28ID%3A+231881%29,"Android, Freelance, Banking, Credit card","KOSH is a USD account built specifically for freelancers and creators across Asia. Unlike Wise or Payoneer, which often restrict or delay USD receiving in many Asian countries, KOSH lets you receive payments directly from Upwork and global clients, hold USD balances reliably, and spend with a credit card - without needing a US entity. Early users report faster access to their earnings and fewer payment rejections.",2026-06-12T07:01:00.000Z
13,Slack AI Data Analyst,Ask about your data without leaving Slack,0,3,https://www.producthunt.com/products/basedash?utm_campaign=producthunt-api&utm_medium=api-v2&utm_source=Application%3A+RanBOT+%28ID%3A+231881%29,https://www.producthunt.com/r/MOY3ZCEEEPW3QE?utm_campaign=producthunt-api&utm_medium=api-v2&utm_source=Application%3A+RanBOT+%28ID%3A+231881%29,"Artificial Intelligence, Data & Analytics, Business Intelligence","Basedash for Slack is your AI data analyst inside Slack — now in the official Slack Marketplace. Mention @Basedash in any channel and it queries your real data sources, thinks in the thread, and replies with an answer and a chart, right where your team is talking. Automations deliver scheduled reports to your channels, and insights surface anomalies automatically — charts included. Ask in Slack. Answered by your data.",2026-06-12T07:01:00.000Z
14,Medicyn,Your complete medical history privately on your device,0,2,https://www.producthunt.com/products/medicyn?utm_campaign=producthunt-api&utm_medium=api-v2&utm_source=Application%3A+RanBOT+%28ID%3A+231881%29,https://www.producthunt.com/r/R42OGAP33HGTCE?utm_campaign=producthunt-api&utm_medium=api-v2&utm_source=Application%3A+RanBOT+%28ID%3A+231881%29,"iOS, Privacy, Medical","The only health app that keeps your medical history completely private—on your device, offline, with no accounts or tracking. Store your complete health record: conditions, medications, prescriptions, allergies, lab reports, surgeries, and more. Scan documents with AI, track symptoms, set reminders, and manage up to 6 family members. 7-day free trial. Then pay once, use forever—no subscriptions, no ads. Your health. Your data. Your control.",2026-06-12T07:01:00.000Z
15, CueBuddy,Record talking videos without manual scrolling,0,1,https://www.producthunt.com/products/cuebuddy?utm_campaign=producthunt-api&utm_medium=api-v2&utm_source=Application%3A+RanBOT+%28ID%3A+231881%29,https://www.producthunt.com/r/IOURJDAI2Z5LJG?utm_campaign=producthunt-api&utm_medium=api-v2&utm_source=Application%3A+RanBOT+%28ID%3A+231881%29,"iOS, Productivity, Video","CueBuddy is a voice-following teleprompter for iPhone and iPad. It scrolls your script as you speak, so creators can record talking videos, courses, speeches, and vlogs without manually controlling the scrolling speed. When you pause, the script pauses. When you continue, it keeps moving. You can try the core experience in the web demo or use the iOS app for a more complete recording workflow.",2026-06-12T07:01:00.000Z
16,LocIn AI,"Localize your app with tone-aware AI, automated workflows",0,1,https://www.producthunt.com/products/locin-ai?utm_campaign=producthunt-api&utm_medium=api-v2&utm_source=Application%3A+RanBOT+%28ID%3A+231881%29,https://www.producthunt.com/r/UM66U5554QVAQF?utm_campaign=producthunt-api&utm_medium=api-v2&utm_source=Application%3A+RanBOT+%28ID%3A+231881%29,"SaaS, Developer Tools, Artificial Intelligence","Translate your app with tone-aware AI, automated localization workflows, CLI integration, and instant API access. Launch globally while keeping your brand voice consistent across every language.",2026-06-12T07:01:00.000Z
17,pleNx — Plex client for Nintendo Switch,The first native Plex client for Nintendo Switch,0,1,https://www.producthunt.com/products/plenx-plex-client-for-nintendo-switch?utm_campaign=producthunt-api&utm_medium=api-v2&utm_source=Application%3A+RanBOT+%28ID%3A+231881%29,https://www.producthunt.com/r/4R652ZKM2NXRUB?utm_campaign=producthunt-api&utm_medium=api-v2&utm_source=Application%3A+RanBOT+%28ID%3A+231881%29,"Nintendo, Open Source, Streaming Services, GitHub","pleNx is a free, open-source, native Plex client for the Nintendo Switch. Browse your server, queue your watchlist, download for offline in original quality, and play with MPV — handheld or docked on any TV.",2026-06-12T07:01:00.000Z
18,Keep,Full-screen 3D clock scenes for your iPhone or Mac,0,1,https://www.producthunt.com/products/keep-8?utm_campaign=producthunt-api&utm_medium=api-v2&utm_source=Application%3A+RanBOT+%28ID%3A+231881%29,https://www.producthunt.com/r/6IV4I3APHRLUCD?utm_campaign=producthunt-api&utm_medium=api-v2&utm_source=Application%3A+RanBOT+%28ID%3A+231881%29,"iOS, Menu Bar Apps, Apple","The default clock got boring. Keep transforms your iPhone and Mac into beautiful 3D ambient clock displays. Use it as a StandBy-style charging display on iPhone with Apple's built-in Shortcuts automation, or replace static screensavers on Mac with animated ambient clocks. Featuring holographic, glass, jelly, wireframe, matrix and morphing liquid-inspired themes designed to become part of your setup.",2026-06-12T07:01:00.000Z
19,What Car Is This,Recognize Any Vehicle with AI,0,1,https://www.producthunt.com/products/what-car-is-this?utm_campaign=producthunt-api&utm_medium=api-v2&utm_source=Application%3A+RanBOT+%28ID%3A+231881%29,https://www.producthunt.com/r/LEW2PGRMRYJSUH?utm_campaign=producthunt-api&utm_medium=api-v2&utm_source=Application%3A+RanBOT+%28ID%3A+231881%29,"Chrome Extensions, SaaS, Artificial Intelligence","Smart What Car Is This? Instantly identify vehicles online with our car identifier. Discover what kind of car is this.Recognize vehicle makes and models from any image in your browser. Powered by AI, the extension delivers fast and accurate identification to help you understand vehicles you encounter online.",2026-06-12T07:01:00.000Z
20,QACAT,Catch translation issues before your users do,0,7,https://www.producthunt.com/products/alconost-localization?utm_campaign=producthunt-api&utm_medium=api-v2&utm_source=Application%3A+RanBOT+%28ID%3A+231881%29,https://www.producthunt.com/r/P7I5RHTCQMEGSH?utm_campaign=producthunt-api&utm_medium=api-v2&utm_source=Application%3A+RanBOT+%28ID%3A+231881%29,"Languages, Developer Tools, Artificial Intelligence","QACAT is a hybrid translation QA platform combining automated rule checks, AI analysis, and expert human review. Upload screenshots and review translations in real product UI — built-in OCR pulls the text for you. Every run gives a structured, scored report with severity breakdowns and an AI summary of what to fix. Works across 100+ languages. Powered by Alconost.",2026-06-12T07:01:00.000Z
