Rank,Name,Tagline,Votes,Comments,URL,Website,Topics,Description,Created At
1,Sendr,"Your complete GTM stack, powered by AI",82,1,https://www.producthunt.com/products/sendr?utm_campaign=producthunt-api&utm_medium=api-v2&utm_source=Application%3A+RanBOT+%28ID%3A+231881%29,https://www.producthunt.com/r/IZWAK74UPCSWHO?utm_campaign=producthunt-api&utm_medium=api-v2&utm_source=Application%3A+RanBOT+%28ID%3A+231881%29,"Sales, Marketing, Artificial Intelligence","Your complete AI-powered GTM stack. Start with a 500M+ contact database, enrich leads, create personalized lipsync videos and dynamic pages, then run sales automations and follow up lead engagement - all in one place. Built for GTM teams to connect smarter and scale faster in one consolidated platform.",2025-11-07T08:01:00.000Z
2,Secure MCP Framework by Arcade.dev,Skip migration. Launch MCP with built-in Auth,79,2,https://www.producthunt.com/products/secure-mcp-framework?utm_campaign=producthunt-api&utm_medium=api-v2&utm_source=Application%3A+RanBOT+%28ID%3A+231881%29,https://www.producthunt.com/r/FLBPOGASZVZXVH?utm_campaign=producthunt-api&utm_medium=api-v2&utm_source=Application%3A+RanBOT+%28ID%3A+231881%29,"Open Source, Developer Tools, Artificial Intelligence","arcade-mcp is the MCP framework that grows with you. Launch a secure MCP server with built in Auth, zero setup, and no rewrites. Write clean Python, scale to production, and connect tools like Gmail or Slack in one line. Open source, eval ready, and works with LangGraph, Cursor, Claude, and more.",2025-11-07T08:01:00.000Z
3,Taskade Genesis,"Your workspace, alive with memory, intelligence, and motion.",74,2,https://www.producthunt.com/products/taskade?utm_campaign=producthunt-api&utm_medium=api-v2&utm_source=Application%3A+RanBOT+%28ID%3A+231881%29,https://www.producthunt.com/r/MV7RYL7PVLUVRE?utm_campaign=producthunt-api&utm_medium=api-v2&utm_source=Application%3A+RanBOT+%28ID%3A+231881%29,"Productivity, Artificial Intelligence, No-Code","Introducing Taskade Genesis, the beginning of living software. Most AI builders stop at static websites with manual integration. Taskade creates systems that keep thinking after you do. Every app you build remembers, learns, and acts inside your workspace. Projects store memory, agents reason and adapt, and automations move work forward. Dashboards, tools, and portals all stay connected, evolving with every action you take. No code. No setup. Just creation. Your workspace, alive.",2025-11-07T08:01:00.000Z
4,Burner Terminal,Tap to Pay for Stablecoins,65,1,https://www.producthunt.com/products/burner-2?utm_campaign=producthunt-api&utm_medium=api-v2&utm_source=Application%3A+RanBOT+%28ID%3A+231881%29,https://www.producthunt.com/r/4MZM2PSUW3AGIT?utm_campaign=producthunt-api&utm_medium=api-v2&utm_source=Application%3A+RanBOT+%28ID%3A+231881%29,"Fintech, Hardware, Crypto","We’re thrilled to announce Burner Terminal, the first point of sale built for native tap to pay stablecoin payments. There is no need for QR codes or opening apps; simply tap Burner to Terminal to immediately pay in USDC on Base. Designed for small businesses everywhere, it makes accepting stablecoins simple, secure, and free from chargebacks and high fees -- and it still accepts traditional credit cards too.",2025-11-07T08:01:00.000Z
5,Pixley AI,Pixley lets kids turn their ideas into cartoons in minutes,64,1,https://www.producthunt.com/products/pixley-ai?utm_campaign=producthunt-api&utm_medium=api-v2&utm_source=Application%3A+RanBOT+%28ID%3A+231881%29,https://www.producthunt.com/r/XQB7FIKQK3YE3U?utm_campaign=producthunt-api&utm_medium=api-v2&utm_source=Application%3A+RanBOT+%28ID%3A+231881%29,"Kids, Artificial Intelligence, Video","Pixley is the first platform that lets children turn their drawings and ideas into personalized, animated cartoons in minutes. Until now, making animation was slow, expensive, and impossible to personalize – but we are the first to unlock long-form video generation with consistent characters and storylines. And the timing could not be better: kids’ content today is overstimulating and empty, while AI video is improving in quality and dropping in cost every month.",2025-11-07T08:01:00.000Z
6,Fusion 1.0,"The first AI agent for product, design, and code",63,2,https://www.producthunt.com/products/builder-io?utm_campaign=producthunt-api&utm_medium=api-v2&utm_source=Application%3A+RanBOT+%28ID%3A+231881%29,https://www.producthunt.com/r/CYKKQ56X4XDYZY?utm_campaign=producthunt-api&utm_medium=api-v2&utm_source=Application%3A+RanBOT+%28ID%3A+231881%29,"Prototyping, Developer Tools, Artificial Intelligence","Fusion is the first AI agent that unifies product, design, and code. It connects Slack, Jira, Figma, and your repo to turn ideas into production features. Edit visually with real code, sync designs bidirectionally, and let the bot handle PRs, fixes, and feedback. With AI memory, design system intelligence, and granular permissions, Fusion learns how your team builds and accelerates delivery across every stage of your workflow.",2025-11-07T08:01:00.000Z
7,American Ratings Lead Magnet Portal,Get Your Verified A-I-R-S Number & Boost Global Credibility,60,0,https://www.producthunt.com/products/american-ratings-lead-magnet-portal?utm_campaign=producthunt-api&utm_medium=api-v2&utm_source=Application%3A+RanBOT+%28ID%3A+231881%29,https://www.producthunt.com/r/VGAIBKGQ3S4VWV?utm_campaign=producthunt-api&utm_medium=api-v2&utm_source=Application%3A+RanBOT+%28ID%3A+231881%29,"SaaS, Affiliate marketing","Build verified business credibility with the American Ratings Lead Magnet Portal — the trusted platform for authentic verification and global rating credentials. Get your A-I-R-S Number to showcase trust, compliance, and excellence. Empower your brand with transparent validation, recognized ratings, and global visibility that help businesses, startups, and professionals gain credibility and stand out worldwide.",2025-11-07T08:01:00.000Z
8,NocoBase 2.0,The most extensible AI-powered no-code platform,19,2,https://www.producthunt.com/products/nocobase?utm_campaign=producthunt-api&utm_medium=api-v2&utm_source=Application%3A+RanBOT+%28ID%3A+231881%29,https://www.producthunt.com/r/JKOS747RHX2QMM?utm_campaign=producthunt-api&utm_medium=api-v2&utm_source=Application%3A+RanBOT+%28ID%3A+231881%29,"Open Source, Artificial Intelligence, GitHub, No-Code",Total control. Infinite extensibility. AI collaboration. Enable your team to adapt quickly and cut costs dramatically. No years of development. No millions wasted. Deploy NocoBase in minutes — and take control of everything.,2025-11-07T08:01:00.000Z
9,LiveAvatar by HeyGen,Realtime lifelike interactive avatars for conversational AI,9,1,https://www.producthunt.com/products/liveavatar-by-heygen?utm_campaign=producthunt-api&utm_medium=api-v2&utm_source=Application%3A+RanBOT+%28ID%3A+231881%29,https://www.producthunt.com/r/7XBMAV4LFQZHCJ?utm_campaign=producthunt-api&utm_medium=api-v2&utm_source=Application%3A+RanBOT+%28ID%3A+231881%29,"Video Streaming, Developer Tools, Artificial Intelligence","LiveAvatar brings AI to life through real-time, face-to-face video communication. Hyper-realistic avatars that see, hear, and respond with natural expression, lip sync, and body language. Built for developers and businesses, these digital agents join you 24/7, scale instantly, speak any language, and transform support, training, and live experiences into human-like conversations.",2025-11-07T08:01:00.000Z
10,Kimi K2 Thinking,Moonshot's best open-source thinking model,9,2,https://www.producthunt.com/products/kimi-ai-assistant?utm_campaign=producthunt-api&utm_medium=api-v2&utm_source=Application%3A+RanBOT+%28ID%3A+231881%29,https://www.producthunt.com/r/O4ADTS7DISHEXG?utm_campaign=producthunt-api&utm_medium=api-v2&utm_source=Application%3A+RanBOT+%28ID%3A+231881%29,"Open Source, Artificial Intelligence, Development","Kimi K2 Thinking is a new 1T parameter open-source agent model. It excels at reasoning, agentic search and coding. The model can execute up to 300 sequential tool calls. It features a 256K context window and native INT4 quantization for 2x speedup.",2025-11-07T08:01:00.000Z
11,Layrr,Framer for your actual codebase,9,1,https://www.producthunt.com/products/layrr?utm_campaign=producthunt-api&utm_medium=api-v2&utm_source=Application%3A+RanBOT+%28ID%3A+231881%29,https://www.producthunt.com/r/I4YXUOZ3OPYVWM?utm_campaign=producthunt-api&utm_medium=api-v2&utm_source=Application%3A+RanBOT+%28ID%3A+231881%29,"Design Tools, Open Source, Artificial Intelligence, GitHub","Layrr gives you Framer-style visual editing for your actual codebase. Drag and resize components, convert Figma to code, edit text in-browser, or design with AI, all while working with real files in your repo. Framework agnostic (React, Vue, Svelte, HTML). Deploy anywhere. 100% free and open-source.",2025-11-07T08:01:00.000Z
12,Jina Debug,AI on call engineer that resolves production issues,6,1,https://www.producthunt.com/products/jina-debug?utm_campaign=producthunt-api&utm_medium=api-v2&utm_source=Application%3A+RanBOT+%28ID%3A+231881%29,https://www.producthunt.com/r/QUXO3YGJDUNRAP?utm_campaign=producthunt-api&utm_medium=api-v2&utm_source=Application%3A+RanBOT+%28ID%3A+231881%29,"SaaS, Software Engineering, Artificial Intelligence","Jina uses your logs and codebase to automatically investigate and resolve your alerts, bugs, and incidents.",2025-11-07T08:01:00.000Z
13,Streaks,Build good habits. Keep your streaks alive.,3,1,https://www.producthunt.com/products/streaks-5?utm_campaign=producthunt-api&utm_medium=api-v2&utm_source=Application%3A+RanBOT+%28ID%3A+231881%29,https://www.producthunt.com/r/T2BCGLZ5OKPQYU?utm_campaign=producthunt-api&utm_medium=api-v2&utm_source=Application%3A+RanBOT+%28ID%3A+231881%29,"Android, Design Tools","Streaks is a minimalist habit-tracker designed for privacy and personalised routines. Set your own habits, see your streaks grow, and stay consistent without distraction. With flexible layouts, colour themes, home-screen widgets and minimal permissions, it puts your progress in focus.",2025-11-07T08:01:00.000Z
14,Workflows,Create with Infinite Creative Control,3,1,https://www.producthunt.com/products/imagine-ai-art-generator?utm_campaign=producthunt-api&utm_medium=api-v2&utm_source=Application%3A+RanBOT+%28ID%3A+231881%29,https://www.producthunt.com/r/HZTJYZ54LQAJ2C?utm_campaign=producthunt-api&utm_medium=api-v2&utm_source=Application%3A+RanBOT+%28ID%3A+231881%29,"Design Tools, Productivity, Artificial Intelligence","Streamline your creative workflows with a simple, organized node-based structure, making it easy to build and share your work.",2025-11-07T08:01:00.000Z
15,SVG Spark - AI SVG Generator,"Free, client‑side SVG to PNG/JPG/GIF/WEBP — with AI",3,1,https://www.producthunt.com/products/svg-spark-ai-svg-generator?utm_campaign=producthunt-api&utm_medium=api-v2&utm_source=Application%3A+RanBOT+%28ID%3A+231881%29,https://www.producthunt.com/r/XA7F2FZSPJMVM3?utm_campaign=producthunt-api&utm_medium=api-v2&utm_source=Application%3A+RanBOT+%28ID%3A+231881%29,"Design Tools, Icons, Wallpaper","SVG Spark: fast, free SVG converter that runs entirely in your browser. Drag and drop your SVGs to instantly export high‑quality PNGs, JPEGs, GIFs, or WEBPs. Because everything is processed locally, nothing is uploaded—keeping your assets private and secure. - Client‑side privacy: All conversion happens in your browser. No uploads, no servers - Multi‑format output: Export to PNG, JPG, GIF, or WEBP in seconds - AI assist: Use AI to create or refine SVGs, then convert them into crisp raster images",2025-11-07T08:01:00.000Z
16,Tooki,The language app for Duolingo graduates,3,1,https://www.producthunt.com/products/tooki?utm_campaign=producthunt-api&utm_medium=api-v2&utm_source=Application%3A+RanBOT+%28ID%3A+231881%29,https://www.producthunt.com/r/E55D6W7K3ZTIGZ?utm_campaign=producthunt-api&utm_medium=api-v2&utm_source=Application%3A+RanBOT+%28ID%3A+231881%29,"iOS, Education, Artificial Intelligence","Tooki gives you real conversation practice anytime, anywhere. Think of it as a phone call in another language with a few extra tools! You can highlight any word for instant translation, adjust the coach's feedback and speed, and schedule calls to keep up the momentum 💪 We made it for intermediate and advanced learners who’ve left streak games behind.",2025-11-07T08:01:00.000Z
17,MyClone,AI Clone that scales your expertise,3,1,https://www.producthunt.com/products/myclone?utm_campaign=producthunt-api&utm_medium=api-v2&utm_source=Application%3A+RanBOT+%28ID%3A+231881%29,https://www.producthunt.com/r/K53DYJYGUBBOGT?utm_campaign=producthunt-api&utm_medium=api-v2&utm_source=Application%3A+RanBOT+%28ID%3A+231881%29,"Productivity, Artificial Intelligence, Audio","An AI platform built for knowledge professionals to help scale their services. Check out the live demo in https://www.myclone.is/ The clone acts as an extension of you, continuously learning from your YouTube, podcasts, documents, videos, and audio. It speaks in your voice, language, and gets integrated into your current workflow (website, Slack, etc.) Oh, you can complete white label it. Think of MyClone as ""Shopify for knowledge professionals"".",2025-11-07T08:01:00.000Z
18,BlogBowl,"3× traffic, 0 coding - let AI run a blog for your business.",3,1,https://www.producthunt.com/products/blogbowl-4?utm_campaign=producthunt-api&utm_medium=api-v2&utm_source=Application%3A+RanBOT+%28ID%3A+231881%29,https://www.producthunt.com/r/XX35U33SE7JHOL?utm_campaign=producthunt-api&utm_medium=api-v2&utm_source=Application%3A+RanBOT+%28ID%3A+231881%29,"Open Source, SEO, Artificial Intelligence, GitHub","Automate your blog with AI that writes research-backed SEO articles exactly like a human would – with images, videos, stats, tables and citations. Optimized for Google and AI platforms like ChatGPT and Claude, they rank well and keep readers engaged. Built on an open-source core with SEO templates, analytics, and newsletter tools. Connect BlogBowl to your landing page, go live in 5 minutes and start getting clients from SEO content.",2025-11-07T08:01:00.000Z
19,Bricks AI Dashboards,"Data to Dashboards, Insights, & Reports in Seconds",2,1,https://www.producthunt.com/products/bricks-7?utm_campaign=producthunt-api&utm_medium=api-v2&utm_source=Application%3A+RanBOT+%28ID%3A+231881%29,https://www.producthunt.com/r/QNWH4Z3HBTESY6?utm_campaign=producthunt-api&utm_medium=api-v2&utm_source=Application%3A+RanBOT+%28ID%3A+231881%29,"Spreadsheets, Data & Analytics, Data Visualization","We set out to do for Power BI and Tableau what Canva did for Photoshop. Bricks lets anyone turn data into beautiful, interactive dashboards and reports in seconds...powerful, simple, and actually fun to use.",2025-11-07T08:01:00.000Z
20,Plantrees,A planner.,2,1,https://www.producthunt.com/products/plantrees-2?utm_campaign=producthunt-api&utm_medium=api-v2&utm_source=Application%3A+RanBOT+%28ID%3A+231881%29,https://www.producthunt.com/r/PZBOZQ7Q4LIDJZ?utm_campaign=producthunt-api&utm_medium=api-v2&utm_source=Application%3A+RanBOT+%28ID%3A+231881%29,"Productivity, Calendar, Artificial Intelligence",A new and fast way to plan and achieve. Plantrees connects your vision with your day to day life and aims to empower you to achieve your goals at an unprecedented speed.,2025-11-07T08:01:00.000Z
