Rank,Name,Tagline,Votes,Comments,URL,Website,Topics,Description,Created At
1,The Map of Human Ideas,Discover where the world’s greatest ideas were born,113,7,https://www.producthunt.com/products/the-map-of-human-ideas?utm_campaign=producthunt-api&utm_medium=api-v2&utm_source=Application%3A+RanBOT+%28ID%3A+231881%29,https://www.producthunt.com/r/7UQOFOFCKMJZ2H?utm_campaign=producthunt-api&utm_medium=api-v2&utm_source=Application%3A+RanBOT+%28ID%3A+231881%29,"Maps, Side Project, Data Visualization","Ever wondered where the world’s biggest ideas came from? The Map of Human Ideas visualizes over 250 discoveries, philosophies, and inventions across centuries. Each point on the map marks the origin of an idea that changed our collective story. Built as a side project to celebrate curiosity and creativity.",2025-11-09T08:01:00.000Z
2,Noro ADHD Planner,Turn a briandump and wordvomit into a structured plan,79,1,https://www.producthunt.com/products/noro-adhd-planner?utm_campaign=producthunt-api&utm_medium=api-v2&utm_source=Application%3A+RanBOT+%28ID%3A+231881%29,https://www.producthunt.com/r/6DLLTJG5Y5C6JO?utm_campaign=producthunt-api&utm_medium=api-v2&utm_source=Application%3A+RanBOT+%28ID%3A+231881%29,"iOS, Productivity, Artificial Intelligence","Noro is the AI-powered ADHD planner that turns messy voice dumps into clean, structured todos with automatic time estimates and subtasks. Built for neurodivergent minds that struggle with time blindness and task initiation, and follow-through.",2025-11-09T08:01:00.000Z
3,Chatter,Discover which reddit investors make it big — and how often,78,2,https://www.producthunt.com/products/chatter-4?utm_campaign=producthunt-api&utm_medium=api-v2&utm_source=Application%3A+RanBOT+%28ID%3A+231881%29,https://www.producthunt.com/r/XUZKTGPMC6X4XK?utm_campaign=producthunt-api&utm_medium=api-v2&utm_source=Application%3A+RanBOT+%28ID%3A+231881%29,"Investing, Artificial Intelligence","Search any stock ticker and discover what Reddit is saying. See which redditors get it right — and how often. Keep track of the posts you like the most and view their performance over time. Currently using data from r/wallstreetbets only, but planning to increase data sources in the future. Completely free to use!",2025-11-09T08:01:00.000Z
4,WordFlippin - Vocabulary that lasts,Flip new words into lasting knowledge daily!!!,77,1,https://www.producthunt.com/products/wordflippin-vocabulary-that-lasts?utm_campaign=producthunt-api&utm_medium=api-v2&utm_source=Application%3A+RanBOT+%28ID%3A+231881%29,https://www.producthunt.com/r/FLNYOWRH6B5EOJ?utm_campaign=producthunt-api&utm_medium=api-v2&utm_source=Application%3A+RanBOT+%28ID%3A+231881%29,"Education, Languages, Artificial Intelligence","Master vocabulary with AI-powered spaced repetition. WordFlippin uses science-backed learning techniques to ensure every new word sticks permanently. Learn smarter, remember longer, and expand your vocab with confidence. Your words. Your pace. Real results.",2025-11-09T08:01:00.000Z
5,Customer Feedback Portal for Jira,"Build what matters, with customer feedback in Jira",75,1,https://www.producthunt.com/products/released-ffb3f8e8-315c-4569-bc4c-9b666d43cd8e?utm_campaign=producthunt-api&utm_medium=api-v2&utm_source=Application%3A+RanBOT+%28ID%3A+231881%29,https://www.producthunt.com/r/S6LFFYK7BISDLA?utm_campaign=producthunt-api&utm_medium=api-v2&utm_source=Application%3A+RanBOT+%28ID%3A+231881%29,"Productivity, Customer Communication, SaaS","Make your Jira roadmaps two-way. Publish updates and ideas, collect feedback from customers and stakeholders, and watch every response flow straight back into Jira. No extra tools, no silos.",2025-11-09T08:01:00.000Z
6,JDoodle.ai,"Vibe app builder with free bug fixes, db and PAYG credits",74,1,https://www.producthunt.com/products/jdoodle-ai?utm_campaign=producthunt-api&utm_medium=api-v2&utm_source=Application%3A+RanBOT+%28ID%3A+231881%29,https://www.producthunt.com/r/V4QXA7NBC4344C?utm_campaign=producthunt-api&utm_medium=api-v2&utm_source=Application%3A+RanBOT+%28ID%3A+231881%29,"Website Builder, No-Code, Vibe coding","From the team behind JDoodle IDE (20M users served). Now bringing AI-powered full stack app building to everyone with a built-in database, hosting, free automatic bug fixing (no credits charged), and simple pay-as-you-go credits.",2025-11-09T08:01:00.000Z
7,Scaloom,The AI Agent That Makes Reddit Trust You,70,1,https://www.producthunt.com/products/scaloom-5?utm_campaign=producthunt-api&utm_medium=api-v2&utm_source=Application%3A+RanBOT+%28ID%3A+231881%29,https://www.producthunt.com/r/CCKTHUKHUA5A3P?utm_campaign=producthunt-api&utm_medium=api-v2&utm_source=Application%3A+RanBOT+%28ID%3A+231881%29,"Social Network, Marketing, Artificial Intelligence","Scaloom is the AI agent that makes Reddit trust you. 🤖 It helps founders and marketers build genuine credibility before promoting their products. Scaloom warms up accounts, earns karma through authentic engagement, finds friendly subreddits, and replies naturally. so you can grow on Reddit without spam, bans, or stress. Start promoting peacefully.",2025-11-09T08:01:00.000Z
8,Astrolid,Because progress shouldn't be difficult,67,1,https://www.producthunt.com/products/astrolid?utm_campaign=producthunt-api&utm_medium=api-v2&utm_source=Application%3A+RanBOT+%28ID%3A+231881%29,https://www.producthunt.com/r/THWT4CXT2ABNI5?utm_campaign=producthunt-api&utm_medium=api-v2&utm_source=Application%3A+RanBOT+%28ID%3A+231881%29,"Productivity, Task Management, Maker Tools","Astrolid is a project management tool that helps makers, creators and founders achieve their objectives faster by tying each task to a goal, and helping people feel the momentum and progress at every step. We show you how much each task makes you progress, unlocking productivity opportunities, and reducing unnecessary work. Most project management tools suck, let me show you why Astrolid doesn't! Check astrolid.com",2025-11-09T08:01:00.000Z
9,Epismo: Kickoff Agent,Build your human-AI team. Assign the right AI to each task.,65,1,https://www.producthunt.com/products/epismo?utm_campaign=producthunt-api&utm_medium=api-v2&utm_source=Application%3A+RanBOT+%28ID%3A+231881%29,https://www.producthunt.com/r/PKYCWXGRX66VIZ?utm_campaign=producthunt-api&utm_medium=api-v2&utm_source=Application%3A+RanBOT+%28ID%3A+231881%29,"Productivity, Task Management, Artificial Intelligence","AI can do a lot, but knowing how to collaborate with it has become a skill in itself. Kickoff Agent makes that collaboration automatic. Simply describe what you want to achieve, and it tells which AI handles each task, or what should be done by yourself. It also provides ready-to-use prompts for every step!",2025-11-09T08:01:00.000Z
10,Devpilot,The AI co-pilot for your entire development lifecycle.,3,1,https://www.producthunt.com/products/devpilot-2?utm_campaign=producthunt-api&utm_medium=api-v2&utm_source=Application%3A+RanBOT+%28ID%3A+231881%29,https://www.producthunt.com/r/OXHLCFEQJ2AHQI?utm_campaign=producthunt-api&utm_medium=api-v2&utm_source=Application%3A+RanBOT+%28ID%3A+231881%29,"API, Developer Tools, GitHub","Devpilot is your new AI co-engineer, designed to take you from a single idea to a fully deployed, full-stack application. Stop wrestling with boilerplate, configuration files, and complex API integrations. Devpilot handles the entire workflow, acting as an autonomous agent that understands your product goals. Autonomous App Generation: Describe your app in plain English, and watch Devpilot build the React/Vite frontend and connect a real database (e.g., Supabase, Firebase) automatically.",2025-11-09T08:01:00.000Z
11,Teda.dev - AI app builder,Generates web applications that don't need a server to run,3,1,https://www.producthunt.com/products/teda-dev-ai-app-builder?utm_campaign=producthunt-api&utm_medium=api-v2&utm_source=Application%3A+RanBOT+%28ID%3A+231881%29,https://www.producthunt.com/r/VN5KUIFFIRY4JO?utm_campaign=producthunt-api&utm_medium=api-v2&utm_source=Application%3A+RanBOT+%28ID%3A+231881%29,"Design Tools, Developer Tools, Artificial Intelligence","Platforms like Lovable and Bolt are trying to do what Teda does, but they make it unnecessarily complex. They force heavy frameworks and serverside logic on simple apps. But simple ideas should be simple to build. You don't need a complex server to record your child's growth. You don't need a heavy database to build a fitness app. You don't need a complex framework to build a portfolio. Teda skips the performance and goes straight to generating superior results and better UI every single time.",2025-11-09T08:01:00.000Z
12,Plants vs Brainrots Stock Guide,"Live seeds, gears, tracker & prediction",2,1,https://www.producthunt.com/products/plants-vs-brainrots-stock-guide?utm_campaign=producthunt-api&utm_medium=api-v2&utm_source=Application%3A+RanBOT+%28ID%3A+231881%29,https://www.producthunt.com/r/UT722R25V4YIFW?utm_campaign=producthunt-api&utm_medium=api-v2&utm_source=Application%3A+RanBOT+%28ID%3A+231881%29,Games,"Get live Plants vs Brainrots Stock information: seeds stock, gears stock, stock tracker and prediction. Learn how to use the official Plants vs Brainrots stock system to catch rare seeds and gears.",2025-11-09T08:01:00.000Z
13,vibe interviews,"Get a job in weeks, not months",2,1,https://www.producthunt.com/products/vibe-interviews?utm_campaign=producthunt-api&utm_medium=api-v2&utm_source=Application%3A+RanBOT+%28ID%3A+231881%29,https://www.producthunt.com/r/LDAYIM566RSRWR?utm_campaign=producthunt-api&utm_medium=api-v2&utm_source=Application%3A+RanBOT+%28ID%3A+231881%29,"Hiring, Education, Career","Land your dream job faster with AI-powered mock interviews. Get real-time feedback, enhance your confidence, and master interview skills to turn job hunting from months to weeks.",2025-11-09T08:01:00.000Z
14,Quran.com,The noble quran,2,1,https://www.producthunt.com/products/quran-com?utm_campaign=producthunt-api&utm_medium=api-v2&utm_source=Application%3A+RanBOT+%28ID%3A+231881%29,https://www.producthunt.com/r/JGRJH3PNZCWF3L?utm_campaign=producthunt-api&utm_medium=api-v2&utm_source=Application%3A+RanBOT+%28ID%3A+231881%29,"Android, Education, Online Learning, Spirituality",The Quran translated into many languages in a simple and easy interface,2025-11-09T08:01:00.000Z
15,Leafed,Book discovery without the surveillance.,2,1,https://www.producthunt.com/products/leafed?utm_campaign=producthunt-api&utm_medium=api-v2&utm_source=Application%3A+RanBOT+%28ID%3A+231881%29,https://www.producthunt.com/r/UVH7XKLIELHV7Z?utm_campaign=producthunt-api&utm_medium=api-v2&utm_source=Application%3A+RanBOT+%28ID%3A+231881%29,"Android, Productivity, Privacy, Books","Leafed is a privacy-first book discovery app that lives entirely on your device. Scan barcodes, search millions of titles, build reading lists, and get personalized recommendations - all without creating an account or sharing your data. Your reading habits stay yours. Available now for Android and iOS.",2025-11-09T08:01:00.000Z
16,ClaudeSkillsHQ,One command. instant skills.,2,1,https://www.producthunt.com/products/claudeskillshq?utm_campaign=producthunt-api&utm_medium=api-v2&utm_source=Application%3A+RanBOT+%28ID%3A+231881%29,https://www.producthunt.com/r/O2VIA7E52IU36A?utm_campaign=producthunt-api&utm_medium=api-v2&utm_source=Application%3A+RanBOT+%28ID%3A+231881%29,"Productivity, Artificial Intelligence, Tech",Run one command. Get instant access to 90+ verified Claude skills. No GitHub. No manual setup. Professional marketplace with native MCP integration.,2025-11-09T08:01:00.000Z
17,Hours Tracker - HourStreaks,Fastest way to input entry in timesheet,1,1,https://www.producthunt.com/products/hours-tracker-hourstreaks?utm_campaign=producthunt-api&utm_medium=api-v2&utm_source=Application%3A+RanBOT+%28ID%3A+231881%29,https://www.producthunt.com/r/SFX6Y23UO5FYI4?utm_campaign=producthunt-api&utm_medium=api-v2&utm_source=Application%3A+RanBOT+%28ID%3A+231881%29,"Time Tracking, Business","HourStreaks is a fast, streak‑based timesheet for tracking work hours and earnings with zero friction. - Three‑tap time range picker: Start Hour → End Hour → Confirm - Edit multiple time ranges in a streak‑based interface - Night shift mode support - Celebrate with a confetti screen and earnings reveal after saving - Exports: CSV, Excel, PDF - Report customization: date ranges, titles, staff name/ID, and date/time formats Perfect for freelancers, contractors, and shift workers.",2025-11-09T08:01:00.000Z
18,Ice Breaker Games,Quick ideas to energize any group,1,1,https://www.producthunt.com/products/ice-breaker-games-2?utm_campaign=producthunt-api&utm_medium=api-v2&utm_source=Application%3A+RanBOT+%28ID%3A+231881%29,https://www.producthunt.com/r/U24TNSAGHCCQJ2?utm_campaign=producthunt-api&utm_medium=api-v2&utm_source=Application%3A+RanBOT+%28ID%3A+231881%29,"Events, Open Source, GitHub, Games","Find ready-to-run ice breaker games and openers for meetings, teams, classrooms, and events—no prep, just play.",2025-11-09T08:01:00.000Z
19,PNG to PDF Online,Png to pdf — free online converter,1,1,https://www.producthunt.com/products/png-to-pdf-online?utm_campaign=producthunt-api&utm_medium=api-v2&utm_source=Application%3A+RanBOT+%28ID%3A+231881%29,https://www.producthunt.com/r/LQ5FG75CTZ6VZT?utm_campaign=producthunt-api&utm_medium=api-v2&utm_source=Application%3A+RanBOT+%28ID%3A+231881%29,"Design Tools, Productivity, Tech","Convert PNG to PDF instantly in your browser. Fast, high-quality PNG to PDF conversion with multi-image support, batch merge, and ZIP download. 100% client-side processing, no uploads required, complete privacy protection.",2025-11-09T08:01:00.000Z
20,Buildsheet,Create beautiful cheatsheets,1,0,https://www.producthunt.com/products/buildsheet?utm_campaign=producthunt-api&utm_medium=api-v2&utm_source=Application%3A+RanBOT+%28ID%3A+231881%29,https://www.producthunt.com/r/Q265YVUYPCZS5U?utm_campaign=producthunt-api&utm_medium=api-v2&utm_source=Application%3A+RanBOT+%28ID%3A+231881%29,"Productivity, Writing, Notes","A visual cheatsheet builder that helps you turn scattered notes into structured masterpieces. Think Notion + LaTeX + Markdown + Charts, all in one clean, fast tool ⚡",2025-11-09T08:01:00.000Z
