Rank,Name,Tagline,Votes,Comments,URL,Website,Topics,Description,Created At
1,MeDo by Baidu,Build full-stack apps with AI at a fraction of the cost,99,15,https://www.producthunt.com/products/medo-2?utm_campaign=producthunt-api&utm_medium=api-v2&utm_source=Application%3A+RanBOT+%28ID%3A+231881%29,https://www.producthunt.com/r/CATHSTFC3A6J2O?utm_campaign=producthunt-api&utm_medium=api-v2&utm_source=Application%3A+RanBOT+%28ID%3A+231881%29,"Website Builder, Artificial Intelligence, Vibe coding","MeDo uses agentic AI to build production‑ready full‑stack apps — frontend, backend, database and integrations — in minutes. By automating code, infra and wiring, MeDo slashes development time and hosting costs so you can ship high‑quality MVPs at a fraction of the cost.",2025-11-05T08:01:00.000Z
2,Extra Thursday,"Chat with your inbox. Ask questions, draft, summarize – fast",84,1,https://www.producthunt.com/products/extra-thursday?utm_campaign=producthunt-api&utm_medium=api-v2&utm_source=Application%3A+RanBOT+%28ID%3A+231881%29,https://www.producthunt.com/r/ADVCS4JA45PGEV?utm_campaign=producthunt-api&utm_medium=api-v2&utm_source=Application%3A+RanBOT+%28ID%3A+231881%29,"Email, Productivity, Artificial Intelligence","Imagine if ChatGPT lived deep inside your inbox — and handled anything you asked. Extra Thursday brings that to life. Chat with your entire inbox instead of one thread at a time. Ask broad questions, track open loops, find who’s waiting on you, and draft polished replies in seconds. Powered by deep-context AI that reads and understands your conversations, Thursday helps you summarize, search, and send thousands of personalized emails — effortlessly.",2025-11-05T08:01:00.000Z
3,GitLaw Agent,AI that drafts and reviews legal documents for free,78,6,https://www.producthunt.com/products/gitlaw?utm_campaign=producthunt-api&utm_medium=api-v2&utm_source=Application%3A+RanBOT+%28ID%3A+231881%29,https://www.producthunt.com/r/JTNC2TIDW3QLQQ?utm_campaign=producthunt-api&utm_medium=api-v2&utm_source=Application%3A+RanBOT+%28ID%3A+231881%29,"Productivity, Legal, Operations","Chat with GitLaw to instantly draft contracts, review legal documents and understand terms in plain English. • Lawyer-vetted templates customised at AI speed • Understand legal documents in simple terms • One seamless workflow Start for free to cut the time wasted and money lost on legal busywork.",2025-11-05T08:01:00.000Z
4,Context Link,Personal URLs for sharing context with AI,76,2,https://www.producthunt.com/products/context-link?utm_campaign=producthunt-api&utm_medium=api-v2&utm_source=Application%3A+RanBOT+%28ID%3A+231881%29,https://www.producthunt.com/r/FMJS6KY3PEAQR4?utm_campaign=producthunt-api&utm_medium=api-v2&utm_source=Application%3A+RanBOT+%28ID%3A+231881%29,"Artificial Intelligence, Marketing automation, Notion","We built Context Link to make AI tools know what you already know. Connect your docs, Notion pages, or sites once, then share your personal link with ChatGPT/Claude/Copilot. It’ll search your sources semantically by meaning and return just the right snippets (in an AI friendly markdown format). Great for marketing, customer support and technical questions. Internally we use it both programatically and in chat bot sessions.",2025-11-05T08:01:00.000Z
5,Apple App Store,"Find apps & games for iPhone, iPad, Mac & more — on the web",75,2,https://www.producthunt.com/products/apple?utm_campaign=producthunt-api&utm_medium=api-v2&utm_source=Application%3A+RanBOT+%28ID%3A+231881%29,https://www.producthunt.com/r/R6RXXMJ6FULM22?utm_campaign=producthunt-api&utm_medium=api-v2&utm_source=Application%3A+RanBOT+%28ID%3A+231881%29,"iOS, Mac, Apple","You can now get the full App Store experience right in your browser, with dedicated pages for the iPhone, iPad, Mac, Vision, Watch, and TV app libraries. Previously, Apple’s “apps.apple.com” domain simply redirected you to a generic page about the App Store on Apple’s website. Now, it takes you to a full-fledged version of the App Store you can browse on your computer.",2025-11-05T08:01:00.000Z
6,Agora Store Builder,Vibe code an e-commerce store with distribution built-in,74,2,https://www.producthunt.com/products/agora-store-builder?utm_campaign=producthunt-api&utm_medium=api-v2&utm_source=Application%3A+RanBOT+%28ID%3A+231881%29,https://www.producthunt.com/r/RUTRXXG3RVZIRQ?utm_campaign=producthunt-api&utm_medium=api-v2&utm_source=Application%3A+RanBOT+%28ID%3A+231881%29,"Website Builder, Artificial Intelligence, E-Commerce","Build your AI-powered e-commerce store in minutes. We help you launch a store with built-in features like domain setup, payments, order tracking, analytics, apps, templates, and more. No coding or effort needed.",2025-11-05T08:01:00.000Z
7,Perch,Dynamic Island for Mac Notch,73,3,https://www.producthunt.com/products/perch-7?utm_campaign=producthunt-api&utm_medium=api-v2&utm_source=Application%3A+RanBOT+%28ID%3A+231881%29,https://www.producthunt.com/r/SNTUMN4MUSPGDB?utm_campaign=producthunt-api&utm_medium=api-v2&utm_source=Application%3A+RanBOT+%28ID%3A+231881%29,"Mac, Productivity, Tech","Transform your Mac's notch into a powerful productivity hub. Chat with Apple Intelligence right from your notch. Completely on-device, private, and unlimited—no internet required. Media controls, live weather, camera access, and calendar. Predefined timers and stopwatch for Pomodoro sessions, cooking, or any time tracking needs. Store text snippets and access your complete clipboard history. Quick-access notepad for capturing thoughts instantly. Temporary staging area for files.",2025-11-05T08:01:00.000Z
8,Blindspot,Book 2.5M+ billboards worldwide like you book an Uber,72,2,https://www.producthunt.com/products/blindspot-4?utm_campaign=producthunt-api&utm_medium=api-v2&utm_source=Application%3A+RanBOT+%28ID%3A+231881%29,https://www.producthunt.com/r/VXMSW55V745JXU?utm_campaign=producthunt-api&utm_medium=api-v2&utm_source=Application%3A+RanBOT+%28ID%3A+231881%29,"Marketing, Advertising, Tech","Imagine your ads in Times Square or anywhere else in the world. Blindspot lets you pick the exact billboards you want, the hours you need with a creative that works, swapped in real-time when the weather, traffic, or crowd changes. Spots are as low as $1/hour.",2025-11-05T08:01:00.000Z
9,FlowBot,Whatsapp automation with no-code AI chatbot builder,71,1,https://www.producthunt.com/products/flowbot-2?utm_campaign=producthunt-api&utm_medium=api-v2&utm_source=Application%3A+RanBOT+%28ID%3A+231881%29,https://www.producthunt.com/r/SE4M6RXYCX5XEY?utm_campaign=producthunt-api&utm_medium=api-v2&utm_source=Application%3A+RanBOT+%28ID%3A+231881%29,"Messaging, Developer Tools, Artificial Intelligence",Flowbot turns WhatsApp automation into a conversation. Describe what you want — Flowbot builds it instantly. Boost engagement and automate customer workflows effortlessly in 2025.,2025-11-05T08:01:00.000Z
10,ROAARRR,Simple growth analytics. Know your funnel.,70,3,https://www.producthunt.com/products/roaarrr?utm_campaign=producthunt-api&utm_medium=api-v2&utm_source=Application%3A+RanBOT+%28ID%3A+231881%29,https://www.producthunt.com/r/LXY2KHUEY6ZE3M?utm_campaign=producthunt-api&utm_medium=api-v2&utm_source=Application%3A+RanBOT+%28ID%3A+231881%29,"Analytics, Marketing, Data & Analytics",Stop juggling multiple analytics platforms. ROAARRR shows your funnel from awareness to retention in one simple tool.,2025-11-05T08:01:00.000Z
11,Arcitext.com,Write in your voice. Perfect it with AI.,69,2,https://www.producthunt.com/products/arcitext?utm_campaign=producthunt-api&utm_medium=api-v2&utm_source=Application%3A+RanBOT+%28ID%3A+231881%29,https://www.producthunt.com/r/CUHPDGCQ7MTJFX?utm_campaign=producthunt-api&utm_medium=api-v2&utm_source=Application%3A+RanBOT+%28ID%3A+231881%29,"Writing, Marketing, Artificial Intelligence","Write faster, without breaking character. Arcitext analyzes your text and extracts your brands or personal writing fingerprint. Next it acts as your personal writing coach and content strategist. Lock in your writing style, and get help from AI only when you need it, and free your creativity.",2025-11-05T08:01:00.000Z
12,Snyk Studio,Real-time security guardrails for your AI code assistant,65,1,https://www.producthunt.com/products/snyk?utm_campaign=producthunt-api&utm_medium=api-v2&utm_source=Application%3A+RanBOT+%28ID%3A+231881%29,https://www.producthunt.com/r/5SKVBYTLWP54RO?utm_campaign=producthunt-api&utm_medium=api-v2&utm_source=Application%3A+RanBOT+%28ID%3A+231881%29,"Developer Tools, Artificial Intelligence, Security","Stop insecure AI code before it lands. Snyk Studio plugs into your AI code assistants (and VS Code, Cursor, and others) to scan code suggestions in real time, flag risky patterns, and guide safer fixes by these coding agents. Snyk Studio also injects Snyk’s security expert context so your assistant can plan and apply fixes to existing vulnerabilities without ever leaving the editor and terminal.",2025-11-05T08:01:00.000Z
13,Nexorify,Create reminders & calendar events instantly by speaking,64,1,https://www.producthunt.com/products/nexorify?utm_campaign=producthunt-api&utm_medium=api-v2&utm_source=Application%3A+RanBOT+%28ID%3A+231881%29,https://www.producthunt.com/r/UKPK56MQUO4SN7?utm_campaign=producthunt-api&utm_medium=api-v2&utm_source=Application%3A+RanBOT+%28ID%3A+231881%29,"Productivity, Task Management, Calendar","Nexorify turns your voice into instant reminders and calendar events — no typing, no friction. Just say, “Create a calendar event tomorrow from 10 to 11 AM, ‘Meeting with a colleague,’ and remind me 30 minutes before,” or “Remind me to send the report in 2 hours.” Nexorify does the rest. It removes the gap between thought and action — built for people who talk faster than they type.",2025-11-05T08:01:00.000Z
14,Alpha Vantage MCP,Have a natural-language conversation with financial markets,61,1,https://www.producthunt.com/products/alpha-vantage?utm_campaign=producthunt-api&utm_medium=api-v2&utm_source=Application%3A+RanBOT+%28ID%3A+231881%29,https://www.producthunt.com/r/GMT3A6QIOGVUVC?utm_campaign=producthunt-api&utm_medium=api-v2&utm_source=Application%3A+RanBOT+%28ID%3A+231881%29,"Fintech, Investing, Artificial Intelligence","Ask your LLMs or agentic tools anything you want about the market. In 30-seconds, connect your favorite LLM to our live financial market data, which covers real-time equities, options chains, crypto, FX, commodities, fundamentals, economic indicators, and 50+ technical signals. Then one-shot your analysis.",2025-11-05T08:01:00.000Z
15,SpotiDost,"Friendly Spotify 2 Mp3 Downloader, Playlist, Album Converter",61,1,https://www.producthunt.com/products/spotidost?utm_campaign=producthunt-api&utm_medium=api-v2&utm_source=Application%3A+RanBOT+%28ID%3A+231881%29,https://www.producthunt.com/r/MZA4YN4TFEFIQT?utm_campaign=producthunt-api&utm_medium=api-v2&utm_source=Application%3A+RanBOT+%28ID%3A+231881%29,"Music, Spotify, Social Media","SpotiDost is a fast and simple Spotify to MP3 downloader for tracks, albums and playlists. Paste a Spotify link, click Download, and grab the songs you love. Currently SpotiDost supports Single Tracks, Playlists & Album Songs! You can download unlimited number of Spotify Songs using our tool.",2025-11-05T08:01:00.000Z
16,FOLO,India's 1st NetWorth App,13,13,https://www.producthunt.com/products/folo-3?utm_campaign=producthunt-api&utm_medium=api-v2&utm_source=Application%3A+RanBOT+%28ID%3A+231881%29,https://www.producthunt.com/r/P5UGRVXBJLOBFY?utm_campaign=producthunt-api&utm_medium=api-v2&utm_source=Application%3A+RanBOT+%28ID%3A+231881%29,"Fintech, Money, Personal Finance","FOLO is your one secure place to see, understand, and grow your NetWorth together with your family. It brings everything you own and everything you owe together in real time to build your complete NetWorth. You can share it, leverage it, or prepare it for generational transfer, all in the most secure and easy-to-use environment. We make better financial choices when we have clarity. Built with design clarity, absolute privacy, and real-time computation, FOLO is India’s first NetWorth App.",2025-11-05T08:01:00.000Z
17,Euverify GDPR Representative(Article 27),Appoint your Article 27 GDPR Representative in the UK & EU,10,2,https://www.producthunt.com/products/euverify?utm_campaign=producthunt-api&utm_medium=api-v2&utm_source=Application%3A+RanBOT+%28ID%3A+231881%29,https://www.producthunt.com/r/TQSZD6PCQU7U4X?utm_campaign=producthunt-api&utm_medium=api-v2&utm_source=Application%3A+RanBOT+%28ID%3A+231881%29,"SaaS, Privacy, Data","Appoint your GDPR Article 27 Representative in the EU and UK with Euverify. Handle regulator inquiries, DSARs, and maintain your ROPA automatically — all in one secure dashboard designed for effortless global compliance.",2025-11-05T08:01:00.000Z
18,Visibility by Causo,See what AI models understand about your business,7,3,https://www.producthunt.com/products/visibility-by-causo?utm_campaign=producthunt-api&utm_medium=api-v2&utm_source=Application%3A+RanBOT+%28ID%3A+231881%29,https://www.producthunt.com/r/CISNJZUAM6ZTLD?utm_campaign=producthunt-api&utm_medium=api-v2&utm_source=Application%3A+RanBOT+%28ID%3A+231881%29,"Analytics, Artificial Intelligence, Search","Visibility by Causo measures how AI systems understand your company. It runs structured scans through ChatGPT, Claude, Gemini, and Perplexity to show what each model knows about your startup, where gaps exist, and how to fix them.",2025-11-05T08:01:00.000Z
19,AlterBase,Find better alternatives to expensive software,6,1,https://www.producthunt.com/products/alterbase?utm_campaign=producthunt-api&utm_medium=api-v2&utm_source=Application%3A+RanBOT+%28ID%3A+231881%29,https://www.producthunt.com/r/NNVYNHYYSVO7SH?utm_campaign=producthunt-api&utm_medium=api-v2&utm_source=Application%3A+RanBOT+%28ID%3A+231881%29,"Marketing, SaaS, Developer Tools","Discover budget-friendly alternatives to expensive software and tools. Compare features, pricing, and find the perfect tool for your needs. Submit and explore 1000+ alternatives.",2025-11-05T08:01:00.000Z
20,RFP Generator by SparrowGenie,Create professional RFP's in minutes,4,2,https://www.producthunt.com/products/rfp-generator-by-sparrowgenie?utm_campaign=producthunt-api&utm_medium=api-v2&utm_source=Application%3A+RanBOT+%28ID%3A+231881%29,https://www.producthunt.com/r/FTLQVMPOXF5ZT3?utm_campaign=producthunt-api&utm_medium=api-v2&utm_source=Application%3A+RanBOT+%28ID%3A+231881%29,"Productivity, Sales",Generate complete RFPs in minutes using secure AI or build them manually with guided control.,2025-11-05T08:01:00.000Z
