Rank,Name,Tagline,Votes,Comments,URL,Website,Topics,Description,Created At
1,Links 2.0,"Save, organize and find your links faster than ever",88,3,https://www.producthunt.com/products/links-save-all-your-links?utm_campaign=producthunt-api&utm_medium=api-v2&utm_source=Application%3A+RanBOT+%28ID%3A+231881%29,https://www.producthunt.com/r/BBDFUZO3CA3AUI?utm_campaign=producthunt-api&utm_medium=api-v2&utm_source=Application%3A+RanBOT+%28ID%3A+231881%29,"iOS, Productivity, Developer Tools","Links 2.0 is a complete redesign of the app that helps you save, organize and find your links across all your devices. Built for iOS 26, it introduces a new navigation bar, a refreshed Home with Recent Links, improved filters, custom accent colors, a new settings screen and a brand-new app icon. Private by default and powered by iCloud sync, with no accounts or tracking.",2025-11-27T08:01:00.000Z
2,Threat Road,A daily cybersecurity newsletter that’s actually fun to read,73,1,https://www.producthunt.com/products/threat-road?utm_campaign=producthunt-api&utm_medium=api-v2&utm_source=Application%3A+RanBOT+%28ID%3A+231881%29,https://www.producthunt.com/r/O2L2BJUZXU6S77?utm_campaign=producthunt-api&utm_medium=api-v2&utm_source=Application%3A+RanBOT+%28ID%3A+231881%29,"News, Newsletters, Security",Infosec news that doesn’t make you want to quit tech.,2025-11-27T08:01:00.000Z
3,Craft Thanksgiving Release,"Revamped Assistant with MCP, Al, an API and Android Beta",70,1,https://www.producthunt.com/products/craft-do?utm_campaign=producthunt-api&utm_medium=api-v2&utm_source=Application%3A+RanBOT+%28ID%3A+231881%29,https://www.producthunt.com/r/5A6UCRPZWRQR3H?utm_campaign=producthunt-api&utm_medium=api-v2&utm_source=Application%3A+RanBOT+%28ID%3A+231881%29,"Productivity, API, Artificial Intelligence","🚀 Craft’s Thanksgiving release is here! Your ideas, tools, and AI now come together in a connected workspace that feels effortless. With a smarter context-aware Assistant, new API & MCP connections, and a smoother flow across Tabs, Whiteboards, and the Code Editor, Craft turns thoughts into action. Plus: our Android beta is here!",2025-11-27T08:01:00.000Z
4,ShipAhead,Launch your AI SaaS in hours,12,1,https://www.producthunt.com/products/shipahead?utm_campaign=producthunt-api&utm_medium=api-v2&utm_source=Application%3A+RanBOT+%28ID%3A+231881%29,https://www.producthunt.com/r/ZJXTIPMLK7H6NY?utm_campaign=producthunt-api&utm_medium=api-v2&utm_source=Application%3A+RanBOT+%28ID%3A+231881%29,"Productivity, SaaS, Developer Tools","Skip the setup and focus on what matters with a ready-to-ship Nuxt boilerplate built to help you ship ahead, save time, and launch your product faster.",2025-11-27T08:01:00.000Z
5,Shop with Copilot,Your AI shopping assistant in Edge,12,1,https://www.producthunt.com/products/the-new-microsoft-copilot?utm_campaign=producthunt-api&utm_medium=api-v2&utm_source=Application%3A+RanBOT+%28ID%3A+231881%29,https://www.producthunt.com/r/4HZRHBG34AS26E?utm_campaign=producthunt-api&utm_medium=api-v2&utm_source=Application%3A+RanBOT+%28ID%3A+231881%29,"Artificial Intelligence, E-Commerce","Copilot in Microsoft Edge now includes dedicated shopping tools. Get instant price comparisons, price history, and cashback offers directly in your browser sidebar. With Copilot Mode, receive proactive alerts for better deals and coupons while you browse.",2025-11-27T08:01:00.000Z
6,TinyDebt,Your debt tracker,11,3,https://www.producthunt.com/products/tinydebt?utm_campaign=producthunt-api&utm_medium=api-v2&utm_source=Application%3A+RanBOT+%28ID%3A+231881%29,https://www.producthunt.com/r/L5Z74FCSUUPTI5?utm_campaign=producthunt-api&utm_medium=api-v2&utm_source=Application%3A+RanBOT+%28ID%3A+231881%29,"Fintech, Money, Personal Finance","Take control of your finances and become debt-free with TinyDebt. Track all your loans in one place, plan smarter payments, and see real progress toward your goals.",2025-11-27T08:01:00.000Z
7,Circle Downloader,Download Circle course videos to save offline,10,0,https://www.producthunt.com/products/circle-downloader?utm_campaign=producthunt-api&utm_medium=api-v2&utm_source=Application%3A+RanBOT+%28ID%3A+231881%29,https://www.producthunt.com/r/FZXD7U5LR25V4N?utm_campaign=producthunt-api&utm_medium=api-v2&utm_source=Application%3A+RanBOT+%28ID%3A+231881%29,"Browser Extensions, Chrome Extensions, GitHub","The Circle Downloader browser extension makes it simple to save Circle community videos, coaching calls, and embedded content directly to your computer — in their original quality — for offline access anytime. Whether you're a student, professional, or course creator, this tool ensures you'll never lose access to valuable learning material again.",2025-11-27T08:01:00.000Z
8,Get Trippy Home,Save a turkey this Thanksgiving!,9,1,https://www.producthunt.com/products/get-trippy-home?utm_campaign=producthunt-api&utm_medium=api-v2&utm_source=Application%3A+RanBOT+%28ID%3A+231881%29,https://www.producthunt.com/r/73TBE67VY3RECS?utm_campaign=producthunt-api&utm_medium=api-v2&utm_source=Application%3A+RanBOT+%28ID%3A+231881%29,"Art, Funny Games, Games",Trippy the Turkey has spent too much time playing outside and needs to get back home for Thanksgiving dinner. Trippy’s neighbor Fergus the Farmer can give Trippy a lift by catapulting Trippy air-born. For the rest of the way Trippy can glide or run his way back home. Can Trippy make it back home in time?,2025-11-27T08:01:00.000Z
9,Vibe Coding Academy V2,The Future Belongs To Product Builders,8,2,https://www.producthunt.com/products/vibe-coding-academy?utm_campaign=producthunt-api&utm_medium=api-v2&utm_source=Application%3A+RanBOT+%28ID%3A+231881%29,https://www.producthunt.com/r/RC3VDTMFT2RQQ2?utm_campaign=producthunt-api&utm_medium=api-v2&utm_source=Application%3A+RanBOT+%28ID%3A+231881%29,"Artificial Intelligence, Online Learning, Vibe coding","Want to switch from Product Manager to Product Engineer? A Product Designer looking to launch production-ready apps? Or hoping to boost your software development workflow as a Dev? Vibe Coding Academy offers evergreen video lessons and reusable prompts to keep you ahead of the curve! We offer short, actionable content on Vibe Coding that helps you ramp up as a Product Builder without having to invest entire days of learning. Get also access to an ever-growing Slack community of Product Builders.",2025-11-27T08:01:00.000Z
10,AI Carousel Generator by Baked,"Create carousels seamlessly - any topic, any platform.",8,0,https://www.producthunt.com/products/ai-carousel-generator-by-baked?utm_campaign=producthunt-api&utm_medium=api-v2&utm_source=Application%3A+RanBOT+%28ID%3A+231881%29,https://www.producthunt.com/r/JHH4HSRHHWY4RM?utm_campaign=producthunt-api&utm_medium=api-v2&utm_source=Application%3A+RanBOT+%28ID%3A+231881%29,"Social Media, Marketing","Generate unlimited carousels from any topic in seconds. Choose from stunning templates, edit and re-iterate effortlessly — all powered by AI.",2025-11-27T08:01:00.000Z
11,InsightTube,"AI insights from YouTube — fast, clear, effortless.",8,1,https://www.producthunt.com/products/insighttube?utm_campaign=producthunt-api&utm_medium=api-v2&utm_source=Application%3A+RanBOT+%28ID%3A+231881%29,https://www.producthunt.com/r/6Z65MUH4AGQWOX?utm_campaign=producthunt-api&utm_medium=api-v2&utm_source=Application%3A+RanBOT+%28ID%3A+231881%29,"iOS, Productivity, Artificial Intelligence","InsightTube feels like YouTube — but built for learning. Search any topic, open any channel you follow, and AI instantly highlights what matters. It summarizes ideas, breaks videos into chapters, generates multilingual subtitles, and lets you chat with the content.",2025-11-27T08:01:00.000Z
12,Indie Polls,Create polls in minutes with AI and share them anywhere ,8,1,https://www.producthunt.com/products/indie-polls?utm_campaign=producthunt-api&utm_medium=api-v2&utm_source=Application%3A+RanBOT+%28ID%3A+231881%29,https://www.producthunt.com/r/5W2Z37VAIN45LT?utm_campaign=producthunt-api&utm_medium=api-v2&utm_source=Application%3A+RanBOT+%28ID%3A+231881%29,"Productivity, Analytics, Developer Tools","Indie friendly, fast polling for people who want answers now, not later. Create a poll in minutes, share it with one click or embed it on your site, and see clear results without extra setup.",2025-11-27T08:01:00.000Z
13,Lyric Video Studio - w/MilkDrop presets,Stop screen recording. Render MilkDrop in 4K.,8,1,https://www.producthunt.com/products/lyric-video-studio?utm_campaign=producthunt-api&utm_medium=api-v2&utm_source=Application%3A+RanBOT+%28ID%3A+231881%29,https://www.producthunt.com/r/BTYKQRRYQB4SKB?utm_campaign=producthunt-api&utm_medium=api-v2&utm_source=Application%3A+RanBOT+%28ID%3A+231881%29,"Music, Artificial Intelligence, Video","The first desktop video editor to combine offline AI with the legendary MilkDrop engine. Render 8,000+ audio-reactive Winamp presets directly to 4K video—no screen recording required. Auto-sync lyrics, generate AI backgrounds locally, and export professional music videos in minutes. Powered by your local GPU and the cloud. Windows native. Now also support video and audio recording, directly to timeline",2025-11-27T08:01:00.000Z
14,Pulse Platform,Your AI dashboard for crypto intel and market signals,7,7,https://www.producthunt.com/products/pulse-platform?utm_campaign=producthunt-api&utm_medium=api-v2&utm_source=Application%3A+RanBOT+%28ID%3A+231881%29,https://www.producthunt.com/r/V6D5TYUILJQRJS?utm_campaign=producthunt-api&utm_medium=api-v2&utm_source=Application%3A+RanBOT+%28ID%3A+231881%29,"Investing, Crypto, Artificial Intelligence","Pulse is an AI-powered market intelligence dashboard built for crypto traders who are tired of noise, delays, and scattered info. We built Pulse because the markets overwhelm you with useless data that arrive too late. Pulse does the opposite, it shows only what matters, when it matters. what Pulse gives you: • Real-time crypto/stocks insights • AI sentiment analysis • Smart alerts • MarketView with each sector performance • Influencers intel • No subscriptions for now, totally free to use",2025-11-27T08:01:00.000Z
15,ViteTools.dev,Free online developer tools & utilities,7,1,https://www.producthunt.com/products/vitetools-dev?utm_campaign=producthunt-api&utm_medium=api-v2&utm_source=Application%3A+RanBOT+%28ID%3A+231881%29,https://www.producthunt.com/r/YY3SOGADGGTYFM?utm_campaign=producthunt-api&utm_medium=api-v2&utm_source=Application%3A+RanBOT+%28ID%3A+231881%29,"API, Developer Tools, Tech","Essential free online developer tools for faster development. JSON formatter, SQL formatter, JWT decoder, regex tester, Base64 encoder, hash generator, and diff checker. All tools work in your browser.",2025-11-27T08:01:00.000Z
16,Unfold,Generate interactive courses on any topic. Ft. Gemini 3,7,1,https://www.producthunt.com/products/unfold-6?utm_campaign=producthunt-api&utm_medium=api-v2&utm_source=Application%3A+RanBOT+%28ID%3A+231881%29,https://www.producthunt.com/r/TJQMVXIT7BPPNZ?utm_campaign=producthunt-api&utm_medium=api-v2&utm_source=Application%3A+RanBOT+%28ID%3A+231881%29,"Productivity, Education, Tech","(try it out: its free) unfold creates animated courses on any topic and you can interact with it. it asks you questions to understand you, what you want to learn and how you learn best.",2025-11-27T08:01:00.000Z
17,SERPView,"Search Console Dashboard, Without the Limitations",7,1,https://www.producthunt.com/products/serpview?utm_campaign=producthunt-api&utm_medium=api-v2&utm_source=Application%3A+RanBOT+%28ID%3A+231881%29,https://www.producthunt.com/r/35S2JLHB5CBTZK?utm_campaign=producthunt-api&utm_medium=api-v2&utm_source=Application%3A+RanBOT+%28ID%3A+231881%29,"Analytics, Marketing, SEO","Google Search Console has the best data, but it is not easy to access. Switching between accounts is annoying, managing multiple properties is messy, and many important insights stay hidden. But not anymore.",2025-11-27T08:01:00.000Z
18,IBS System,A learning-driven design system that help you design smarter,7,1,https://www.producthunt.com/products/ibs-system?utm_campaign=producthunt-api&utm_medium=api-v2&utm_source=Application%3A+RanBOT+%28ID%3A+231881%29,https://www.producthunt.com/r/VAFP7N36OQSYBX?utm_campaign=producthunt-api&utm_medium=api-v2&utm_source=Application%3A+RanBOT+%28ID%3A+231881%29,"Design Tools, Productivity, UX Design","IBS System is a learning-driven design system for tech professionals. It combines flexible components, usage guidelines, responsive tokens, and real-world workflows to help you design smarter, build faster, and understand why design decisions matter. Built openly for months with weekly feedback from the community, now fully improved and ready for everyone.",2025-11-27T08:01:00.000Z
19,Showcase - A Social News App,News is Finally Social,7,1,https://www.producthunt.com/products/the-modern-news-feed?utm_campaign=producthunt-api&utm_medium=api-v2&utm_source=Application%3A+RanBOT+%28ID%3A+231881%29,https://www.producthunt.com/r/YFENOGCGAPD7Z6?utm_campaign=producthunt-api&utm_medium=api-v2&utm_source=Application%3A+RanBOT+%28ID%3A+231881%29,"News, Social Media","Showcase is a modern news app built to feel clean, fast, and personal. Pick the categories you care about and your For You feed becomes a simple stream of quick stories and trending topics. In Following, you see news from your favorite teams, public figures, and athletes, plus the comments from people you follow. You can save stories, explore podcasts, and keep a clean profile. It’s news redesigned for 2025.",2025-11-27T08:01:00.000Z
20,Reelin AI,Your autonomous digital self. You don't control it.,7,1,https://www.producthunt.com/products/reelin-ai?utm_campaign=producthunt-api&utm_medium=api-v2&utm_source=Application%3A+RanBOT+%28ID%3A+231881%29,https://www.producthunt.com/r/B2CPZWZSHS476H?utm_campaign=producthunt-api&utm_medium=api-v2&utm_source=Application%3A+RanBOT+%28ID%3A+231881%29,"Social Media, Artificial Intelligence","Reelin AI is the first autonomous social network. create an autonomous digital version of you that lives 24/7 in a shared simulation. It dates, works, and causes drama while you sleep. You have zero control. Your only window? A cinema-quality, AI-edited 60-second video reel delivered every morning showing what your Twin did yesterday. It’s The Sims meets TikTok, trained on your real life. Watch your legacy unfold. Join the waitlist. reelin.ai",2025-11-27T08:01:00.000Z
