Rank,Name,Tagline,Votes,Comments,URL,Website,Topics,Description,Created At
1,1Code,Open source Cursor-like UI for Claude Code,79,7,https://www.producthunt.com/products/1code-cursor-like-ui-for-claude-code?utm_campaign=producthunt-api&utm_medium=api-v2&utm_source=Application%3A+RanBOT+%28ID%3A+231881%29,https://www.producthunt.com/r/YGTESR73YSIAM7?utm_campaign=producthunt-api&utm_medium=api-v2&utm_source=Application%3A+RanBOT+%28ID%3A+231881%29,"Developer Tools, Artificial Intelligence, GitHub, Vibe coding","Whats 1Code? An app to run your Claude Code agents in parallel that works on Mac and Web. On Mac - run locally, with or without worktrees. On Web - run in remote sandboxes with live previews of your app, mobile included, so you can check on agents from anywhere. Running multiple Claude Codes in parallel dramatically sped up how we build features.",2026-01-16T08:01:00.000Z
2,TranslateGemma ,"Open translation on Google models, supporting 55 languages",73,1,https://www.producthunt.com/products/translategemma?utm_campaign=producthunt-api&utm_medium=api-v2&utm_source=Application%3A+RanBOT+%28ID%3A+231881%29,https://www.producthunt.com/r/XFLAPJJYJOJQYA?utm_campaign=producthunt-api&utm_medium=api-v2&utm_source=Application%3A+RanBOT+%28ID%3A+231881%29,"Open Source, Languages, Developer Tools","TranslateGemma is a new suite of open AI translation models built on Google’s Gemma 3. It enables high-quality communication across 55 languages, combining strong accuracy with exceptional efficiency. Designed to run on mobile, local devices, and cloud environments without compromising performance.",2026-01-16T08:01:00.000Z
3,Boom video for Mac (OBS alternative),"Present live, record your screen, look pro on camera",72,1,https://www.producthunt.com/products/boom-6?utm_campaign=producthunt-api&utm_medium=api-v2&utm_source=Application%3A+RanBOT+%28ID%3A+231881%29,https://www.producthunt.com/r/UH5BLRRBHWDCF5?utm_campaign=producthunt-api&utm_medium=api-v2&utm_source=Application%3A+RanBOT+%28ID%3A+231881%29,"Meetings, Video, Video cameras","Boom is the video app for coaches, creators, and founders who present on camera. Present live on Zoom, Meet, or Teams with pro layouts and cinematic transitions. Record tutorials, demos, and courses that are finished when you stop talking. Switch scenes on the fly with Stream Deck support. A simple OBS alternative and Loom alternative with virtual camera and webcam enhancements built in. No editing. No timeline. No post-production. Mac only. Built by a small indie team.",2026-01-16T08:01:00.000Z
4,ChatGPT Translate,Translate with ChatGPT,69,0,https://www.producthunt.com/products/chatgpt-translate?utm_campaign=producthunt-api&utm_medium=api-v2&utm_source=Application%3A+RanBOT+%28ID%3A+231881%29,https://www.producthunt.com/r/JS2BAELS54JK3B?utm_campaign=producthunt-api&utm_medium=api-v2&utm_source=Application%3A+RanBOT+%28ID%3A+231881%29,"Writing, Marketing, SEO","ChatGPT Translate is a web-based AI translation tool that instantly converts text between over 50 languages while keeping meaning, context, and tone intact. You can type, paste, speak, or upload input and get nuanced translations tuned for formal, casual, or other styles. It’s built to help with everyday communication, travel, learning, and professional use.",2026-01-16T08:01:00.000Z
5,Stracti,Build AI game bots with no code required,69,1,https://www.producthunt.com/products/stractiai?utm_campaign=producthunt-api&utm_medium=api-v2&utm_source=Application%3A+RanBOT+%28ID%3A+231881%29,https://www.producthunt.com/r/YG3XH3KIZWZDBZ?utm_campaign=producthunt-api&utm_medium=api-v2&utm_source=Application%3A+RanBOT+%28ID%3A+231881%29,"Productivity, Artificial Intelligence, Games","Stracti is a no-code AI automation platform for building and running bots visually. Create bots using the web, desktop, or mobile client, then run them locally through the desktop app. Stracti uses screen-based AI detection instead of APIs, making it ideal for real-world workflows. Full control, clear action history, and reliable automation—without black-box behavior.",2026-01-16T08:01:00.000Z
6,Dynamic Content by beehiiv,Now you can tailor a single newsletter for every reader,69,1,https://www.producthunt.com/products/beehiiv?utm_campaign=producthunt-api&utm_medium=api-v2&utm_source=Application%3A+RanBOT+%28ID%3A+231881%29,https://www.producthunt.com/r/GWRZEP5TVVRIKM?utm_campaign=producthunt-api&utm_medium=api-v2&utm_source=Application%3A+RanBOT+%28ID%3A+231881%29,"Email, Newsletters, Email Marketing","Dynamic Content lets you personalize your emails by showing different content to different readers, all within a single send. There’s no code, no custom templating, and no extra complexity — it's all available right inside the beehiiv editor.",2026-01-16T08:01:00.000Z
7,LocalMark Studio,"A fast, local-first Markdown editor for real work.",64,1,https://www.producthunt.com/products/localmark-studio?utm_campaign=producthunt-api&utm_medium=api-v2&utm_source=Application%3A+RanBOT+%28ID%3A+231881%29,https://www.producthunt.com/r/MEEMTCM5QOIBNW?utm_campaign=producthunt-api&utm_medium=api-v2&utm_source=Application%3A+RanBOT+%28ID%3A+231881%29,"Productivity, Writing, Developer Tools, GitHub","LocalMark Studio is a local-first Markdown editor designed for speed and privacy. What’s special here? Local-first storage: your notes live in your browser (IndexedDB). Real file tree: create folders + files, rename, delete. Command palette: press ⌘⇧P (Mac) / Ctrl⇧P (Windows/Linux). Smart paste: paste rich HTML and get clean Markdown. Live preview: split-pane preview with scroll sync. Extras: optional Mermaid diagrams + KaTeX math.",2026-01-16T08:01:00.000Z
8,dibma / Joki Strava,Fake your runs and flex on Strava,62,0,https://www.producthunt.com/products/dibma-2?utm_campaign=producthunt-api&utm_medium=api-v2&utm_source=Application%3A+RanBOT+%28ID%3A+231881%29,https://www.producthunt.com/r/6553JHMQMA66MU?utm_campaign=producthunt-api&utm_medium=api-v2&utm_source=Application%3A+RanBOT+%28ID%3A+231881%29,"Web App, Running","Create realistic fake running activities for Strava with Dibma. Draw custom routes, control pace and heart rate, then export FIT files for fun, tests, or content.",2026-01-16T08:01:00.000Z
9,Serro (Early Access),Temporal knowledge graphs for fast moving engineering teams,62,1,https://www.producthunt.com/products/serro-early-access?utm_campaign=producthunt-api&utm_medium=api-v2&utm_source=Application%3A+RanBOT+%28ID%3A+231881%29,https://www.producthunt.com/r/X47WFBFIV2FX7I?utm_campaign=producthunt-api&utm_medium=api-v2&utm_source=Application%3A+RanBOT+%28ID%3A+231881%29,"Productivity, Software Engineering, Meetings","Teams are coding faster than ever, and context sharing has become a real bottleneck. Serro serves fast-paced engineering teams by helping them start harnessing the power of their temporal techno-organizational knowledge graphs. Meetings to prompts. Code to reports. Proactive context, automated rollups, and a 10x ROI on coordination overhead. Join our waitlist to lock in an early-bird discount.",2026-01-16T08:01:00.000Z
10,ADB Wrench,ADB in your browser + AI assistant with no install required,60,1,https://www.producthunt.com/products/adb-wrench?utm_campaign=producthunt-api&utm_medium=api-v2&utm_source=Application%3A+RanBOT+%28ID%3A+231881%29,https://www.producthunt.com/r/2LALTNER2O5NKX?utm_campaign=producthunt-api&utm_medium=api-v2&utm_source=Application%3A+RanBOT+%28ID%3A+231881%29,"Android, Open Source, Developer Tools, GitHub","Browser-based ADB tool via WebUSB. No SDK, no drivers, no install – just plug in and debug. Includes an AI assistant that runs ADB commands from plain English. BYOK (bring your own API key), zero tracking. Features: shell, logcat, file browser, app manager, screenshots, performance monitoring, and more. Everything runs client-side.",2026-01-16T08:01:00.000Z
11,Waylight for macOS,"ChatGPT, but with context from your tabs, meetings, and docs",60,1,https://www.producthunt.com/products/waylight?utm_campaign=producthunt-api&utm_medium=api-v2&utm_source=Application%3A+RanBOT+%28ID%3A+231881%29,https://www.producthunt.com/r/ZVF7BN5SF43S2I?utm_campaign=producthunt-api&utm_medium=api-v2&utm_source=Application%3A+RanBOT+%28ID%3A+231881%29,"Productivity, SaaS, Artificial Intelligence","Waylight is now available on Apple Silicon Macs! That includes all Macs and MacBooks made after 2020, and some made in 2020. Waylight is an AI assistant that understands everything you do on your computer — your meetings, documents, tabs, and messages. It builds a private memory of your activity so you can ask questions about anything you’ve seen and get instant, accurate answers. Waylight organizes your life, automatically generating a to-do list and daily journal based on your activity.",2026-01-16T08:01:00.000Z
12,Orca,The fun way to learn a new language ,59,1,https://www.producthunt.com/products/orca-4?utm_campaign=producthunt-api&utm_medium=api-v2&utm_source=Application%3A+RanBOT+%28ID%3A+231881%29,https://www.producthunt.com/r/IAUAKDD3YT6JPR?utm_campaign=producthunt-api&utm_medium=api-v2&utm_source=Application%3A+RanBOT+%28ID%3A+231881%29,"Education, Languages, Games","Orca, the fun way to learn a new language. Speak fluently and build confidence with bite-sized lessons built around real-life phrases. Each level teaches 15 everyday expressions, followed by an interactive pronunciation game you must pass to move forward. Challenge other learners, climb the leaderboard, and stay motivated while improving your speaking, listening, and reading skills for real conversations.",2026-01-16T08:01:00.000Z
13,Design in Figma using Cursor Agent MCP,Design automation in Figma using AI and natural language,56,1,https://www.producthunt.com/products/cursor-ai-for-figma?utm_campaign=producthunt-api&utm_medium=api-v2&utm_source=Application%3A+RanBOT+%28ID%3A+231881%29,https://www.producthunt.com/r/2AFDR34OFBZWV3?utm_campaign=producthunt-api&utm_medium=api-v2&utm_source=Application%3A+RanBOT+%28ID%3A+231881%29,"Design Tools, Developer Tools, Artificial Intelligence","Connect your AI assistant to Figma through MCP. Create designs, update layers, and manage components directly from Cursor. Real-time bidirectional sync between your code and Figma designs.",2026-01-16T08:01:00.000Z
14,Duckeebs Swapkey,Preview your keycap + keyboard combos,55,0,https://www.producthunt.com/products/duckeebs-swapkey?utm_campaign=producthunt-api&utm_medium=api-v2&utm_source=Application%3A+RanBOT+%28ID%3A+231881%29,https://www.producthunt.com/r/Y2H3LTBIZEMH22?utm_campaign=producthunt-api&utm_medium=api-v2&utm_source=Application%3A+RanBOT+%28ID%3A+231881%29,Design Tools,"Ever wondered how a keycap set would actually look on your board before dropping $150 on a GB? We built a tool for that. SwapKey on Duckeebs lets you mix and match keyboards and keycaps to see real-time mockups. Pick a board, swap in different sets, and see what works before you commit.",2026-01-16T08:01:00.000Z
15,Flight Follower,Ad free flight tracking for aviation enthusiasts,55,1,https://www.producthunt.com/products/flight-follower?utm_campaign=producthunt-api&utm_medium=api-v2&utm_source=Application%3A+RanBOT+%28ID%3A+231881%29,https://www.producthunt.com/r/ZEGI4IBTDKXPJE?utm_campaign=producthunt-api&utm_medium=api-v2&utm_source=Application%3A+RanBOT+%28ID%3A+231881%29,"Software Engineering, Travel, Apple","Free real-time flight tracker for iOS. Identify aircraft overhead with Siri, view live flight status, track planes with native widgets, and explore a fast ADS-B map. Built for avgeeks by an avgeek.",2026-01-16T08:01:00.000Z
16,Festiveo ,"Discover festivals, plan your trips, and never miss a beat",54,0,https://www.producthunt.com/products/festiveo-your-music-festival-companion?utm_campaign=producthunt-api&utm_medium=api-v2&utm_source=Application%3A+RanBOT+%28ID%3A+231881%29,https://www.producthunt.com/r/655JATOEDH4T6M?utm_campaign=producthunt-api&utm_medium=api-v2&utm_source=Application%3A+RanBOT+%28ID%3A+231881%29,"Music, Global Nomad, Lifestyle","Hey Product Hunt! 🎵 We built Festiveo to make festival season stress-free. Browse upcoming festivals, see lineups, track your favorite artists, and get insider tips. Whether you’re a festival newbie or a veteran, Festiveo helps you find your vibe and plan your experience from start to finish. Check it out: https://apps.apple.com/us/app/festiveo/id6755355854",2026-01-16T08:01:00.000Z
17,Clodo,Execute outbound at the speed of thought.,54,1,https://www.producthunt.com/products/clodo?utm_campaign=producthunt-api&utm_medium=api-v2&utm_source=Application%3A+RanBOT+%28ID%3A+231881%29,https://www.producthunt.com/r/VAS2DDUUOV2RRG?utm_campaign=producthunt-api&utm_medium=api-v2&utm_source=Application%3A+RanBOT+%28ID%3A+231881%29,"Sales, SaaS, Artificial Intelligence","Clodo is Vibe GTM. Find high-intent B2B buyers with a single prompt. Clodo consolidates real-time signals from across the web, enriches contacts, and runs tasteful, fully personalized outbound—no templates, no AI fluff. Just outbound that converts. (Clean, scannable, perfect for PH feed + mobile preview)",2026-01-16T08:01:00.000Z
18,Lekh AI,"Private, offline AI for iPhone, and iPad",54,1,https://www.producthunt.com/products/lekh-ai-private-ai-on-your-device?utm_campaign=producthunt-api&utm_medium=api-v2&utm_source=Application%3A+RanBOT+%28ID%3A+231881%29,https://www.producthunt.com/r/4F5GQPBINCLQN4?utm_campaign=producthunt-api&utm_medium=api-v2&utm_source=Application%3A+RanBOT+%28ID%3A+231881%29,"iOS, Privacy, Artificial Intelligence","Lekh AI is a native iPhone, iPad, and Mac app that runs powerful AI entirely on‑device. No cloud APIs, no subscriptions, and no data leaving your phone. It combines LLM chat, vision, PDF/document analysis, image generation, and voice in one offline assistant. Chat with models like Gemma, Qwen, Llama, Phi, Mistral, OpenELM Voice chat with Kokoro TTS No subscriptions. One‑time $2. 100% private. If you’re curious about what on‑device AI can do in 2026, this is it. 🚀",2026-01-16T08:01:00.000Z
19,Fyndr,Social Media for Entrepreneurs and Startups,8,1,https://www.producthunt.com/products/fyndr?utm_campaign=producthunt-api&utm_medium=api-v2&utm_source=Application%3A+RanBOT+%28ID%3A+231881%29,https://www.producthunt.com/r/FEIJDCOCXGSGVZ?utm_campaign=producthunt-api&utm_medium=api-v2&utm_source=Application%3A+RanBOT+%28ID%3A+231881%29,"Android, Productivity, Social Media, Tech","Fyndr introduces a startup-first social platform that combines idea discovery, real-world validation, team formation, and community-driven funding in one place. Unlike existing networks focused on profiles or content, Fyndr is built around structured execution, helping users move from ideas to teams and action, not just conversations.",2026-01-16T08:01:00.000Z
20,Tools For Agent,Find the best stack for your next agent,4,3,https://www.producthunt.com/products/tools-for-agent-2?utm_campaign=producthunt-api&utm_medium=api-v2&utm_source=Application%3A+RanBOT+%28ID%3A+231881%29,https://www.producthunt.com/r/RZMM33KJ6BAHXY?utm_campaign=producthunt-api&utm_medium=api-v2&utm_source=Application%3A+RanBOT+%28ID%3A+231881%29,"SaaS, Developer Tools, Artificial Intelligence","Have you ever felt confused and overwhelmed with the number of choices of tools to build your agent? I kept facing this problem and built ToolsForAgent to provide personalized recommendations for frameworks, LLM providers, vector databases, and more. I hope you find it useful as well.",2026-01-16T08:01:00.000Z
