Rank,Name,Tagline,Votes,Comments,URL,Website,Topics,Description,Created At
1,Slashy,The AI assistant that does email for you,0,27,https://www.producthunt.com/products/slashy-3?utm_campaign=producthunt-api&utm_medium=api-v2&utm_source=Application%3A+RanBOT+%28ID%3A+231881%29,https://www.producthunt.com/r/723Q6GNIWDBMQM?utm_campaign=producthunt-api&utm_medium=api-v2&utm_source=Application%3A+RanBOT+%28ID%3A+231881%29,"Email, Artificial Intelligence, Virtual Assistants","Slashy is an AI-native email client and assistant that drafts replies in your voice, triages what matters, and makes sure no follow-up slips, so you spend less time in your inbox and more time on what matters. It connects to your email, calendar, CRM, and meeting notes and learns how you work, so you can ask Slashy to prep you for your next meeting, draft a follow-up, clear your inbox to zero, track who still owes you a reply, or fire off an email from iMessage or Slack while you're on the go.",2026-06-14T07:01:00.000Z
2,Permute 4.0,The ultimate media converter for macOS,0,1,https://www.producthunt.com/products/permute?utm_campaign=producthunt-api&utm_medium=api-v2&utm_source=Application%3A+RanBOT+%28ID%3A+231881%29,https://www.producthunt.com/r/7DGX3DO3UNS2TC?utm_campaign=producthunt-api&utm_medium=api-v2&utm_source=Application%3A+RanBOT+%28ID%3A+231881%29,"Mac, Photo & Video, Video","Permute is a quick image, audio, and video converter. You can use it for files of all formats because Permute can convert anything into anything (almost). For water to water-to-wine conversion, you’d have to refer to other authorities, but media files can become whatever format you need them to. Plus, Permute also has some additional goodies like merging two videos into one or adding a subtitle track.",2026-06-14T07:01:00.000Z
3,Athenic 2.0,"A faster, smarter Athenic. Analyze on autopilot.",0,3,https://www.producthunt.com/products/athenic-ai?utm_campaign=producthunt-api&utm_medium=api-v2&utm_source=Application%3A+RanBOT+%28ID%3A+231881%29,https://www.producthunt.com/r/RPHLNAADRGEJ3M?utm_campaign=producthunt-api&utm_medium=api-v2&utm_source=Application%3A+RanBOT+%28ID%3A+231881%29,"Analytics, Business Intelligence, Data Visualization","Athenic is an AI agent for analyzing data and automating work. Connect your data, chat in plain English, and ship dashboards, reports, and automations. Built for startups to Fortune 500.",2026-06-14T07:01:00.000Z
4,Cloudback for Linear,Automated backup and restore for Linear workspaces,0,3,https://www.producthunt.com/products/cloudback?utm_campaign=producthunt-api&utm_medium=api-v2&utm_source=Application%3A+RanBOT+%28ID%3A+231881%29,https://www.producthunt.com/r/AJD3WYKDXZTMGK?utm_campaign=producthunt-api&utm_medium=api-v2&utm_source=Application%3A+RanBOT+%28ID%3A+231881%29,"Productivity, Software Engineering, Developer Tools","Cloudback runs automated, snapshot-based backups for Linear workspaces, GitHub, GitLab, and Azure DevOps. Linear capture covers 23 data categories: issues, projects, cycles, documents, comments, attachments, embedded files, and the workspace structure itself. Restore in dependency order from any backup, into a new target workspace. AES-256 with optional customer-managed keys (RSA Lockbox). SOC 2 Type II compliant. 1.7k+ customers, 14k+ repositories, 4M+ backups.",2026-06-14T07:01:00.000Z
5,Folio,Claude for PowerPoint on steroids,0,1,https://www.producthunt.com/products/folio-ai?utm_campaign=producthunt-api&utm_medium=api-v2&utm_source=Application%3A+RanBOT+%28ID%3A+231881%29,https://www.producthunt.com/r/BEQVATQ56EE33A?utm_campaign=producthunt-api&utm_medium=api-v2&utm_source=Application%3A+RanBOT+%28ID%3A+231881%29,"Productivity, Artificial Intelligence, Tech","Folio is the AI copilot for decks where every slide counts. Goes harder on quality than any of the alternatives, thanks to our proprietary slides engine. Works directly in PowerPoint - built for consultants and finance teams. Try it today!",2026-06-14T07:01:00.000Z
6,Conan,A native Mac cockpit for Claude Code,0,2,https://www.producthunt.com/products/conan?utm_campaign=producthunt-api&utm_medium=api-v2&utm_source=Application%3A+RanBOT+%28ID%3A+231881%29,https://www.producthunt.com/r/YCRXMCPH3NBX33?utm_campaign=producthunt-api&utm_medium=api-v2&utm_source=Application%3A+RanBOT+%28ID%3A+231881%29,"Mac, Developer Tools, Artificial Intelligence","Conan is a native macOS app that wraps Claude Code in a live HUD — every prompt, tool call, skill, and token, surfaced as it happens.",2026-06-14T07:01:00.000Z
7,Reverie.fm,A fully private & offline location based music journal app,0,0,https://www.producthunt.com/products/reverie-fm?utm_campaign=producthunt-api&utm_medium=api-v2&utm_source=Application%3A+RanBOT+%28ID%3A+231881%29,https://www.producthunt.com/r/ETIUC5Z6WKYK2T?utm_campaign=producthunt-api&utm_medium=api-v2&utm_source=Application%3A+RanBOT+%28ID%3A+231881%29,"Music, Maps","Reverie FM maps your life's soundtrack. I built it because I wanted to remember not just where I was, but what I was listening to. It lets you pin songs to specific places on a map, attaching moods and memories to those spots. It's completely private, local, and built for Apple Music. It's a personal atlas of the songs that I was and the locations that remind me of them.",2026-06-14T07:01:00.000Z
8,Taste Lab,Extract any website's design DNA,0,1,https://www.producthunt.com/products/taste-lab?utm_campaign=producthunt-api&utm_medium=api-v2&utm_source=Application%3A+RanBOT+%28ID%3A+231881%29,https://www.producthunt.com/r/KOJGXLNJOQGWQI?utm_campaign=producthunt-api&utm_medium=api-v2&utm_source=Application%3A+RanBOT+%28ID%3A+231881%29,"Design Tools, Artificial Intelligence, Vibe coding","Point your AI agent at any website. Get back a complete design breakdown — colors, type, spacing, and the reasoning behind every decision — ready to use in your next build.",2026-06-14T07:01:00.000Z
9,Allergo,"Translate your allergies, anywhere.",0,2,https://www.producthunt.com/products/allergo-allergy-translation-cards?utm_campaign=producthunt-api&utm_medium=api-v2&utm_source=Application%3A+RanBOT+%28ID%3A+231881%29,https://www.producthunt.com/r/WJYHGPH6R7XFWF?utm_campaign=producthunt-api&utm_medium=api-v2&utm_source=Application%3A+RanBOT+%28ID%3A+231881%29,"Health & Fitness, Travel, Health","Allergo helps you create allergy translation cards for 75+ languages/countries. Add cards to Apple Wallet for quick access anywhere. Features also include conversation helpers and emergency SOS translations, automatically translated to the users location. Designed for real-world use, with localisation across countries. Professional translations, and more native speaker verifications, are coming soon via over-the-air updates. Built for anyone travelling with allergies or dietary restrictions.",2026-06-14T07:01:00.000Z
10,Memoriq,"Your private AI memory for ChatGPT, Claude, Gemini and Grok",0,1,https://www.producthunt.com/products/memoriq?utm_campaign=producthunt-api&utm_medium=api-v2&utm_source=Application%3A+RanBOT+%28ID%3A+231881%29,https://www.producthunt.com/r/FGPLN55XYVVARV?utm_campaign=producthunt-api&utm_medium=api-v2&utm_source=Application%3A+RanBOT+%28ID%3A+231881%29,"Productivity, Privacy, Artificial Intelligence","Memoriq is your private AI memory for ChatGPT, Claude, Gemini and Grok. Save the conversations that matter in an end-to-end encrypted vault that only you can access. Open source, self-hostable, and built for people who don't want to lose valuable AI chats or trust another plaintext cloud service. Search, organize, and keep your AI knowledge under your control.",2026-06-14T07:01:00.000Z
11,Web Researcher MCP,The AI research assistant that cites real sources honestly,0,1,https://www.producthunt.com/products/web-researcher-mcp?utm_campaign=producthunt-api&utm_medium=api-v2&utm_source=Application%3A+RanBOT+%28ID%3A+231881%29,https://www.producthunt.com/r/QFPT72SXZ45KRI?utm_campaign=producthunt-api&utm_medium=api-v2&utm_source=Application%3A+RanBOT+%28ID%3A+231881%29,"Open Source, Artificial Intelligence, GitHub, Search","Search the entire web or narrow it down to just the sites you trust; medical journals, court databases, news outlets, academic papers. Analyze the full source, not just snippets. Links that work, citations you can trust, no made up closed garden pre-synthesized results. Your AI links to papers that don't exist, invents DOIs, and presents SEO spam with the same confidence as peer-reviewed research. It can't even tell a blog post from a court filing. This MCP solves it.",2026-06-14T07:01:00.000Z
12,1ClickReport — Marketing AI in Claude,"Run Google Ads, Meta & GA4 from Claude — you approve",0,1,https://www.producthunt.com/products/1click-report?utm_campaign=producthunt-api&utm_medium=api-v2&utm_source=Application%3A+RanBOT+%28ID%3A+231881%29,https://www.producthunt.com/r/WGMQ6QVNOLYMIC?utm_campaign=producthunt-api&utm_medium=api-v2&utm_source=Application%3A+RanBOT+%28ID%3A+231881%29,"Analytics, Marketing, Artificial Intelligence","1ClickReport — Claude that RUNS your marketing, not just reports on it Two upgrades since our Nov 2025 beta: 🆕 MCP integration — Connect Google Ads, Meta, GA4, Search Console & Stripe. Ask ""where am I wasting spend?"" → Claude finds it AND fixes it (create, pause, adjust). You approve every change. 🆕 24/7 monitoring agents — Set a rule (""alert if CPA > $50""), approve in chat, runs every 6h & emails on breach. ⚡ Bonus: AI dashboards in 60s. 7-day trial, no card.",2026-06-14T07:01:00.000Z
13,Baroque ,The canvas where AI designs your whole product,0,1,https://www.producthunt.com/products/baroque?utm_campaign=producthunt-api&utm_medium=api-v2&utm_source=Application%3A+RanBOT+%28ID%3A+231881%29,https://www.producthunt.com/r/CWLHAR6734Z63I?utm_campaign=producthunt-api&utm_medium=api-v2&utm_source=Application%3A+RanBOT+%28ID%3A+231881%29,"Design Tools, Developer Tools, Artificial Intelligence","Every AI tool hands you the same generic slop. Same gradients, same layouts, no soul. Baroque is built different. Real design taste, baked into every screen. Recreate, remix, or start from scratch. One canvas for your whole product, not just one screen.",2026-06-14T07:01:00.000Z
14,Roast My Resume,AI roasts your resume. You screenshot the trauma.,0,1,https://www.producthunt.com/products/roast-my-resume-4?utm_campaign=producthunt-api&utm_medium=api-v2&utm_source=Application%3A+RanBOT+%28ID%3A+231881%29,https://www.producthunt.com/r/NEEHSWK7GD6RLR?utm_campaign=producthunt-api&utm_medium=api-v2&utm_source=Application%3A+RanBOT+%28ID%3A+231881%29,"Web App, Hiring, Career",AI roasts your resume with battle-rap energy. Paste your '7 years of robust full-stack experience' and watch it translate to '7 years of making stuff up as I go along.' Then screenshot the share card. Free. Anonymous. Mildly traumatic.,2026-06-14T07:01:00.000Z
15,Lumora - AI Beauty Camera,Turn one selfie into a full AI Beauty DNA report,0,1,https://www.producthunt.com/products/lumora-ai-beauty-camera?utm_campaign=producthunt-api&utm_medium=api-v2&utm_source=Application%3A+RanBOT+%28ID%3A+231881%29,https://www.producthunt.com/r/UWP3S2G25U2OKS?utm_campaign=producthunt-api&utm_medium=api-v2&utm_source=Application%3A+RanBOT+%28ID%3A+231881%29,"iOS, Photography, Artificial Intelligence","Lumora turns a single selfie into a full Beauty DNA Report — skin score, hair match, makeup palette, personal color, and style persona, all from AI analysis. Plus 7 AI photo transforms and on-device Y2K filters. iOS.",2026-06-14T07:01:00.000Z
16,GentleCase—Built for Immigration Firms,"Immigration case management, without the chaos",0,1,https://www.producthunt.com/products/gentlecase-built-for-immigration-firms?utm_campaign=producthunt-api&utm_medium=api-v2&utm_source=Application%3A+RanBOT+%28ID%3A+231881%29,https://www.producthunt.com/r/KYDKGUFEVQFCGS?utm_campaign=producthunt-api&utm_medium=api-v2&utm_source=Application%3A+RanBOT+%28ID%3A+231881%29,"SaaS, Legal","GentleCase is immigration case management software built for U.S. law firms — client profiles, case tracking, visa templates, deadline alerts, and a branded client portal your clients will actually use.",2026-06-14T07:01:00.000Z
17,Incogniq,P2P WebRTC chat with zero-identity and custom DB signaling.,0,1,https://www.producthunt.com/products/incogniq?utm_campaign=producthunt-api&utm_medium=api-v2&utm_source=Application%3A+RanBOT+%28ID%3A+231881%29,https://www.producthunt.com/r/XX4BIRUIWLQOAU?utm_campaign=producthunt-api&utm_medium=api-v2&utm_source=Application%3A+RanBOT+%28ID%3A+231881%29,"Privacy, Developer Tools, Tech news","Incogniq is an ephemeral, serverless messaging and calling platform designed around absolute anonymity. Unlike traditional apps that require phone numbers, metadata tracking, or centralized cloud backups, Incogniq leaves no trace.",2026-06-14T07:01:00.000Z
18,DualChess,Chess — but a mini-game decides every capture,0,1,https://www.producthunt.com/products/dualchess?utm_campaign=producthunt-api&utm_medium=api-v2&utm_source=Application%3A+RanBOT+%28ID%3A+231881%29,https://www.producthunt.com/r/ZGTWORPFDLJIWV?utm_campaign=producthunt-api&utm_medium=api-v2&utm_source=Application%3A+RanBOT+%28ID%3A+231881%29,"Web App, Education, Games","Play chess online, locally, or vs AI (4 levels) — but here's the twist: every capture is settled by a fast reflex mini-game. Lining up a piece doesn't guarantee the take — you have to win Pong, Labyrinth, Quick Draw, Memory Match, Target Practice or Tug of War to claim it. Strategy meets nerve, so even a beginner can upset a stronger player. Real-time online play, a global leaderboard, installable as an app — and free, running instantly in your browser. No download.",2026-06-14T07:01:00.000Z
19,PandaProbe Cloud,"agent engineering, fully managed.",0,1,https://www.producthunt.com/products/pandaprobe-cloud?utm_campaign=producthunt-api&utm_medium=api-v2&utm_source=Application%3A+RanBOT+%28ID%3A+231881%29,https://www.producthunt.com/r/EFZITJ632XZJX3?utm_campaign=producthunt-api&utm_medium=api-v2&utm_source=Application%3A+RanBOT+%28ID%3A+231881%29,"Open Source, Developer Tools, Artificial Intelligence, GitHub","PandaProbe Cloud gives your team full-stack tracing, evals, and monitoring for agents with zero infrastructure to manage. Ship better agents without the ops overhead.",2026-06-14T07:01:00.000Z
20,Pool,Save anything with a screenshot. ,0,1,https://www.producthunt.com/products/pool-4?utm_campaign=producthunt-api&utm_medium=api-v2&utm_source=Application%3A+RanBOT+%28ID%3A+231881%29,https://www.producthunt.com/r/EL6DFVOIIE4N2C?utm_campaign=producthunt-api&utm_medium=api-v2&utm_source=Application%3A+RanBOT+%28ID%3A+231881%29,"Productivity, User Experience, Photography","Save anything with a screenshot! Pool is a new way to save and organize the things you capture. We take screenshots to remember - a recipe, a podcast, a product, a place. But they usually disappear in your camera roll. Pool turns your screenshots into structured content you can organize, revisit, and act on. With Pool, you can: - Organize screenshots into pools - Automatically categorize content and find the original links - Share pools with friends - Keep everything searchable",2026-06-14T07:01:00.000Z
